"Caatinga Conservation and Sustainable Management Project",1476,Brazil,"Biodiversity, Land Degradation","Full-size Project","The World Bank","10,000,000","13,060,000",Completed,2007,"GEF Trust Fund",No,No,"GEF - 3"
"Establishing the Basis for Biodiversity Conservation on Sapo National Park and in South-East Liberia",1475,Liberia,Biodiversity,"Medium-size Project","The World Bank","975,000","1,439,000",Completed,2004,"GEF Trust Fund",No,No,"GEF - 3"
"Enabling Activities for the Stockholm Convention on Persistent Organic Pollutants (POPs): National Implementation Plan for Kenya",1474,Kenya,"Chemicals and Waste","Enabling Activity","United Nations Environment Programme","425,000","41,000",Completed,2001,"GEF Trust Fund",No,No,"GEF - 2"
"Enabling Activities for the Stockholm Convention on Persistent Organic Pollutants (POPs): National Implementation Plan for Côte d’Ivoire",1473,"Cote d'Ivoire","Chemicals and Waste","Enabling Activity","United Nations Environment Programme","282,476","14,700",Completed,2001,"GEF Trust Fund",No,No,"GEF - 2"
"Best Environmental Practice in the Hosting of the World Summit on Sustainable Development",1472,"South Africa",,"Medium-size Project","United Nations Development Programme","1,000,000","2,727,500",Completed,2002,"GEF Trust Fund",No,No,"GEF - 2"
"Improving Management of NGO and Privately Owned Nature Reserves and High Biodiversity Islands in Seychelles",1471,Seychelles,Biodiversity,"Medium-size Project","The World Bank","814,000","1,074,700",Completed,2002,"GEF Trust Fund",No,No,"GEF - 3"
"Enabling Activities to Facilitate Early Action on the Implementation of the Stockholm Convention on Persistent Organic Pollutants (POPs) in Romania",1470,Romania,"Chemicals and Waste","Enabling Activity","United Nations Industrial Development Organization","495,000",,Completed,2001,"GEF Trust Fund",No,No,"GEF - 2"
"Initial Assistance to the Slovak Republic to meet its obligations under the Stockholm Convention on Persistent Organic Pollutants POPs",1469,"Slovak Republic","Chemicals and Waste","Enabling Activity","United Nations Development Programme","475,000",,Completed,2001,"GEF Trust Fund",No,No,"GEF - 2"
"Add On - Consultations for the Second Report to CBD and CHM",1468,Tanzania,Biodiversity,"Enabling Activity","United Nations Development Programme","38,950","22,000",Completed,2001,"GEF Trust Fund",No,No,"GEF - 2"
"Expedited Financing of Climate Change Enabling Activities Part II, Expedited Financing for (interim) Measures for Capacity Building in Priority Areas",1467,"Cote d'Ivoire","Climate Change","Enabling Activity","United Nations Environment Programme","100,000",,Completed,2001,"GEF Trust Fund",No,No,"GEF - 2"
"Enabling Activities to Facilitate Early Action on the Implementation of the Stockholm Convention on Persistent Organic Pollutants (POPs) in Ghana",1466,Ghana,"Chemicals and Waste","Enabling Activity","United Nations Industrial Development Organization","497,000",,Completed,2001,"GEF Trust Fund",No,No,"GEF - 2"
"Enabling Activities to Facilitate Early Action on the Implementation of the Stockholm Convention on Persistent Organic Pollutants (POPs)",1465,Mongolia,"Chemicals and Waste","Enabling Activity","United Nations Industrial Development Organization","492,000",,Completed,2002,"GEF Trust Fund",No,No,"GEF - 3"
"Programme for the Agulhas and Somali Current Large Marine Ecosystems: Agulhas and Somali Current Large Marine Ecosystems Project (ASCLMEs)",1462,"Madagascar, Kenya, Mozambique, Tanzania, Seychelles, Comoros, Mauritius, South Africa, Regional","International Waters","Full-size Project","United Nations Development Programme","12,200,000","18,470,000",Completed,2006,"GEF Trust Fund",No,No,"GEF - 3"
"Strengthening the Implementation Capacities for Nutrient Reduction and Transboundary Cooperation in the Danube River Basin-Phase IProject Short Title:Danube Regional Project Phase 1",1460,"Bulgaria, Romania, Serbia, Hungary, Bosnia-Herzegovina, Ukraine, Slovenia, Slovak Republic, Croatia, Moldova, Czech Republic, Regional","International Waters","Full-size Project","United Nations Development Programme","5,000,000","6,600,000",Completed,2001,"GEF Trust Fund",No,No,"GEF - 2"
"Recovery, Conservation, and Sustainable Use of Georgia’s Agrobiodiversity",1458,Georgia,Biodiversity,"Medium-size Project","United Nations Development Programme","962,408","1,716,800",Completed,2004,"GEF Trust Fund",No,No,"GEF - 3"
"Initial assistance to Samoa to meet its obligations under the Stockholm Convention on POPs",1457,Samoa,"Chemicals and Waste","Enabling Activity","United Nations Development Programme","372,500",,Completed,2001,"GEF Trust Fund",No,No,"GEF - 2"
"Add-on: Biodiversity Enabling Activities: Assessment of Capacity Building Needs for Biodiversity Conservation and Sustainable Use",1456,Poland,Biodiversity,"Enabling Activity","United Nations Environment Programme","234,000","61,600",Completed,2001,"GEF Trust Fund",No,No,"GEF - 2"
"Capacity Building for Small Island Developing States through SIDSNet",1455,Global,,"Medium-size Project","United Nations Development Programme","1,000,000","507,932",Completed,2001,"GEF Trust Fund",No,No,"GEF - 2"
"Climate Change Enabling Activity (additional financing for capacity building in priority areas)",1452,Guatemala,"Climate Change","Enabling Activity","United Nations Development Programme","100,000",,Completed,2001,"GEF Trust Fund",No,No,"GEF - 2"
"Development of National Implementation Plan for Vietnam in the Process of Accession, Implementation and Enforcement of the Newly-signed Stockholm Convention on POPs",1450,"Viet Nam","Chemicals and Waste","Enabling Activity","United Nations Development Programme","500,000","150,000",Completed,2001,"GEF Trust Fund",No,No,"GEF - 2"
"Initial Assistance to the Philippines to Meet its Obligations Under the Stockholm Convention on POPs",1449,Philippines,"Chemicals and Waste","Enabling Activity","United Nations Development Programme","500,000","82,000",Completed,2001,"GEF Trust Fund",No,No,"GEF - 2"
"Building Human and Institutional Capacities to Address Climate Change Issues in 46 Least-Developed Countries",1447,Global,"Climate Change","Enabling Activity","United Nations Development Programme","903,960",,Completed,2001,"GEF Trust Fund",No,No,"GEF - 2"
"Conservation and Sustainable Use of Biodiversity in the Peruvian Amazon by the Indigenous Ashaninka Population",1446,Peru,Biodiversity,"Medium-size Project","United Nations Development Programme","975,000","556,980",Completed,2003,"GEF Trust Fund",No,No,"GEF - 3"
"Development and Implementation of the Lake Peipsi/Chudskoe Basin Management Plan",1444,"Estonia, Russian Federation, Regional","International Waters","Medium-size Project","United Nations Development Programme","1,000,000","3,775,000",Completed,2002,"GEF Trust Fund",No,No,"GEF - 2"
"Biodiversity Enabling Activity - Add-on components for Niue",1442,Niue,Biodiversity,"Enabling Activity","United Nations Development Programme","280,000","25,000",Completed,2001,"GEF Trust Fund",No,No,"GEF - 2"
"Assessment of Capacity Building Needs for Biodiversity Conservation and Management in the Philippines (add on)",1440,Philippines,Biodiversity,"Enabling Activity","United Nations Development Programme","157,350",,Completed,2001,"GEF Trust Fund",No,No,"GEF - 2"
"Efficient Lighting Initiative (ELI)",1439,"Czech Republic, Philippines, Latvia, Hungary, Global","Climate Change","Full-size Project","The World Bank, International Finance Corporation","7,090,000","33,000,000",Completed,2005,"GEF Trust Fund",No,No,"GEF - 2"
"Conservation and Sustainable Use of Biodiversity in Dibeen Nature Reserve",1438,Jordan,Biodiversity,"Medium-size Project","United Nations Development Programme","1,000,000","1,020,000",Completed,2002,"GEF Trust Fund",No,No,"GEF - 3"
"Assessment of Capacity Building Needs for Implementation of Priorities from the NBSAP (additional financing)",1435,Cambodia,Biodiversity,"Enabling Activity","United Nations Development Programme","97,373",,Completed,2001,"GEF Trust Fund",No,No,"GEF - 2"
"Assessment of Capacity Building Needs and Country/Authority Specific Priorities in Biodiversity (Additional Financing)",1434,Jordan,Biodiversity,"Enabling Activity","United Nations Development Programme","87,500","40,000",Completed,2001,"GEF Trust Fund",No,No,"GEF - 2"
"Support for the Implementation of the Stockholm Convention on Persistent Organic Pollutants",1430,Global,"Chemicals and Waste","Medium-size Project","United Nations Environment Programme","580,000","813,000",Completed,2001,"GEF Trust Fund",No,No,"GEF - 2"
"National Capacity Building to Enable the Sultanate of Oman to Prepare its National Action Plan and First National Communication",1429,Oman,"Climate Change","Enabling Activity","United Nations Development Programme","300,000",,Completed,2002,"GEF Trust Fund",No,No,"GEF - 2"
"Development and Implementation of Mechanisms to disseminate Lessons Learned and Best Practices in Integrated Transboundary Water Resources Management in Latin America and the Caribbean",1426,Brazil,"International Waters","Medium-size Project","United Nations Environment Programme","972,000","665,000",Completed,2002,"GEF Trust Fund",No,No,"GEF - 3"
"Indonesia Forests and Media Project (INFORM)",1424,Indonesia,Biodiversity,"Medium-size Project","The World Bank","940,000","292,055",Completed,2001,"GEF Trust Fund",No,No,"GEF - 2"
"Community -based Conservation and Sustainable Use of the Atiquipa and Taimara Lomas Ecosystems",1416,Peru,Biodiversity,"Medium-size Project","United Nations Development Programme","725,000","1,470,800",Completed,2001,"GEF Trust Fund",No,No,"GEF - 2"
"Energy Efficiency Measures in the Honduran Commercial and Industry Sectors",1413,Honduras,"Climate Change","Medium-size Project","United Nations Development Programme","975,000","1,640,000",Completed,2004,"GEF Trust Fund",Yes,No,"GEF - 3"
"Building the Capacity of the People's Republic of China to Implement the Stockholm Convention on POPs and Develop a National Implementation Plan",1412,China,"Chemicals and Waste","Enabling Activity","United Nations Industrial Development Organization","4,056,500","6,148,750",Completed,2004,"GEF Trust Fund",No,No,"GEF - 3"
"Biodiversity Conservation and Integration of Traditional Knowledge on Medicinal Plants in National Primary Health Care Policy in Central America and Caribbean",1410,"Panama, Nicaragua, Honduras, Dominican Republic, Regional",Biodiversity,"Medium-size Project","United Nations Environment Programme","725,000","800,000",Completed,2001,"GEF Trust Fund",No,No,"GEF - 2"
"Galapagos Oil Spill : Environmental Rehabilitation and Conservation",1409,Ecuador,Biodiversity,"Medium-size Project","United Nations Development Programme","530,000","470,000",Completed,2001,"GEF Trust Fund",No,No,"GEF - 2"
"Biodiversity Conservation and Community Natural Resource Management in the Nanay River Basin (Peruvian Amazon)",1408,Peru,Biodiversity,"Medium-size Project","The World Bank","748,305","802,153",Completed,2001,"GEF Trust Fund",No,No,"GEF - 2"
"Assessment of Capacity-building Needs for Biodiversity, Participation in CHM and Preparation of a Second National Report (add on)",1403,Belarus,Biodiversity,"Enabling Activity","United Nations Environment Programme","183,700","49,000",Completed,2001,"GEF Trust Fund",No,No,"GEF - 2"
"Capacity Building for the Implementation of the Cartagena Protocol on Biosafety",1400,Mexico,Biodiversity,"Medium-size Project","United Nations Development Programme","1,461,148","4,991,000",Completed,2002,"GEF Trust Fund",No,No,"GEF - 2"
"Capacity Building for Implementation of Malaysia's National Biosafety Framework",1399,Malaysia,Biodiversity,"Full-size Project","United Nations Development Programme","911,380","4,303,175",Completed,2006,"GEF Trust Fund",No,No,"GEF - 2"
"Private Land Mechanisms for Biodiversity Conservation in Mexico",1397,Mexico,Biodiversity,"Medium-size Project","The World Bank","725,000","1,100,000",Completed,2001,"GEF Trust Fund",No,No,"GEF - 2"
"Consultations for the Second National Report on Biodiversity (add on)",1396,Madagascar,Biodiversity,"Enabling Activity","United Nations Development Programme","25,000","10,000",Completed,2001,"GEF Trust Fund",No,No,"GEF - 2"
"Climate, Water and Agriculture:  Impacts on and Adaptation of Agro-Ecological Systems in Africa",1394,"Egypt, Cameroon, Nigeria, Zambia, Ghana, Senegal, Ethiopia, Niger, Kenya, Burkina Faso, South Africa, Zimbabwe, Regional",,"Medium-size Project","The World Bank","700,000","540,000",Completed,2001,"GEF Trust Fund",No,No,"GEF - 2"
"Enabling Activities to Facilitate Early Action on the Implementation of the Stockholm Convention on Persistent Organic Pollutants (POPs Convention) in Poland",1389,Poland,"Chemicals and Waste","Enabling Activity","United Nations Industrial Development Organization","496,950",,Completed,2001,"GEF Trust Fund",No,No,"GEF - 2"
"Enabling Activities to Facilitate Early Action on the Implementation of the Stockholm Convention on Persistent Organic Pollutants (POPs)",1388,Hungary,"Chemicals and Waste","Enabling Activity","United Nations Industrial Development Organization","489,472",,Completed,2001,"GEF Trust Fund",No,No,"GEF - 2"
"Establishment of Clearing House Mechanism",1385,Guinea-Bissau,Biodiversity,"Enabling Activity","United Nations Development Programme","14,000",,Completed,2001,"GEF Trust Fund",No,No,"GEF - 2"
"Biodiversity Indicators for National Use",1384,"Ukraine, Ecuador, Philippines, Kenya, Regional",Biodiversity,"Medium-size Project","United Nations Environment Programme","823,200","610,000",Completed,2002,"GEF Trust Fund",No,No,"GEF - 2"
"National Biodiversity Strategy Action Plan and First Report to the COP",1383,Palau,Biodiversity,"Enabling Activity","United Nations Development Programme","330,000",,Completed,2001,"GEF Trust Fund",No,No,"GEF - 2"
"Elimination of Green House Gases in the Manufacturing of Domestic Refrigerators and Freezers at Snaige",1381,Lithuania,"Climate Change","Medium-size Project","United Nations Development Programme","999,900","1,494,000",Completed,2001,"GEF Trust Fund",No,No,"GEF - 2"
"Assessment of Soil Organic Carbon Stocks and Change at National Scales",1378,"Jordan, Brazil, Kenya, India, Global",,"Medium-size Project","United Nations Environment Programme","978,000","1,024,000",Completed,2001,"GEF Trust Fund",No,No,"GEF - 2"
"Santiago Foothills: Mountain Ecosystem Conservation",1377,Chile,Biodiversity,"Medium-size Project","The World Bank","725,000","459,400",Completed,2001,"GEF Trust Fund",No,No,"GEF - 2"
"Reducing Transboundary Degradation in the Kura-Aras Basin",1375,"Azerbaijan, Georgia, Armenia, Regional","International Waters","Full-size Project","United Nations Development Programme","2,900,000","11,724,427",Completed,2009,"GEF Trust Fund",No,No,"GEF - 4"
"Support for the Implementation of the National Biosafety Framework for Bulgaria",1374,Bulgaria,Biodiversity,"Medium-size Project","United Nations Environment Programme","407,879","96,280",Completed,2002,"GEF Trust Fund",No,No,"GEF - 2"
"Support to the Implementation of the National Biosafety Framework",1373,Poland,Biodiversity,"Medium-size Project","United Nations Environment Programme","460,000","2,156,550",Completed,2002,"GEF Trust Fund",No,No,"GEF - 2"
"Support to the Implementation of the National Biosafety Framework",1372,Namibia,Biodiversity,"Medium-size Project","United Nations Environment Programme","672,000","239,000",Completed,2002,"GEF Trust Fund",No,No,"GEF - 2"
"Support to the Implementation of the National Biosafety Framework",1371,Kenya,Biodiversity,"Medium-size Project","United Nations Environment Programme","510,879","108,658",Completed,2002,"GEF Trust Fund",No,No,"GEF - 2"
"Support to the Implementation of the National Biosafety Framework of Cuba",1370,Cuba,Biodiversity,"Medium-size Project","United Nations Environment Programme","646,500","284,142",Completed,2002,"GEF Trust Fund",No,No,"GEF - 2"
"Support to the Implementation of the National Biosafety Framework of China",1369,China,Biodiversity,"Medium-size Project","United Nations Environment Programme","997,400","269,000",Completed,2002,"GEF Trust Fund",No,No,"GEF - 2"
"Support to the Implementation of the National Biosafety Framework for Cameroon",1367,Cameroon,Biodiversity,"Medium-size Project","United Nations Environment Programme","560,300","111,100",Completed,2002,"GEF Trust Fund",No,No,"GEF - 2"
"Support for the Implementation of the Uganda National Biosafety Framework (NBF) within the context of the Cartagena protocol",1366,Uganda,Biodiversity,"Medium-size Project","United Nations Environment Programme","560,000","82,000",Completed,2002,"GEF Trust Fund",No,No,"GEF - 2"
"Enabling Activities for the Preparation of Initial Communication Related to UN Framework Convention on Climate Change (UNFCCC)",1365,Namibia,"Climate Change","Enabling Activity","United Nations Development Programme","130,000","10,000",Completed,2001,"GEF Trust Fund",No,No,"GEF - 2"
"Western Kenya Integrated Ecosystem Management Project",1362,Kenya,,"Full-size Project","The World Bank","4,100,000","4,400,000",Completed,2005,"GEF Trust Fund",No,No,"GEF - 3"
"Generation and Delivery of Renewable Energy Based Modern Energy Services in Cuba; the case of Isla de la Juventud",1361,Cuba,"Climate Change","Full-size Project","United Nations Environment Programme","5,337,000","10,704,000",Completed,2005,"GEF Trust Fund",Yes,No,"GEF - 3"
"Renewable Energy-based Electricity Generation for Isolated Mini-grids",1358,Zambia,"Climate Change","Full-size Project","United Nations Environment Programme","2,950,000","4,556,000",Completed,2005,"GEF Trust Fund",Yes,No,"GEF - 3"
"Forest Sector Development Project",1356,"Viet Nam",Biodiversity,"Full-size Project","The World Bank","9,000,000","65,590,000",Completed,2004,"GEF Trust Fund",No,No,"GEF - 3"
"DBSB Agricultural Pollution Control Project - under WB-GEF Strategic Partnership for Nutrient Reduction in the Danube River and Black Sea",1355,Moldova,"International Waters","Full-size Project","The World Bank","4,950,000","5,790,000",Completed,2004,"GEF Trust Fund",No,No,"GEF - 2"
"Development and Integration of the Environmental Component in the Partnership for Africa Renewal Programme",1354,Regional,,"Medium-size Project","United Nations Environment Programme","300,000","325,000",Completed,2001,"GEF Trust Fund",No,No,"GEF - 2"
"Nature Conservation and Flood Control in the Yangtze River Basin",1353,China,,"Full-size Project","United Nations Environment Programme","3,649,660","22,950,000",Completed,2005,"GEF Trust Fund",No,No,"GEF - 3"
"DBSB Reduction of Nutrient Discharges - under WB-GEF Strategic Partnership for Nutrient Reduction in the Danube River and Black Sea",1351,Hungary,"International Waters","Full-size Project","The World Bank","12,500,000","19,470,000",Completed,2006,"GEF Trust Fund",No,No,"GEF - 3"
"Sustainable Transport and Air Quality for Santiago",1349,Chile,"Climate Change","Full-size Project","The World Bank","6,980,000","7,010,000",Completed,2003,"GEF Trust Fund",No,No,"GEF - 3"
"Integrated Assessment and Management of the Gulf of Mexico Large Marine Ecosystem",1346,Mexico,"International Waters","Full-size Project","United Nations Industrial Development Organization","4,502,500","95,574,780",Completed,2008,"GEF Trust Fund",No,No,"GEF - 4"
"Conservation of Gramineae and Associated Arthropods for Sustainable Agricultural Development in Africa",1344,"Kenya, Mali, Ethiopia, Regional",Biodiversity,"Medium-size Project","United Nations Environment Programme","947,000","1,564,250",Completed,2001,"GEF Trust Fund",No,No,"GEF - 2"
"Demonstrations of Integrated Ecosystem and Watershed Management in the Caatinga, Phase I",1343,Brazil,,"Full-size Project","United Nations Development Programme","4,000,000","22,324,262",Completed,2004,"GEF Trust Fund",No,No,"GEF - 3"
"Promoting Industrial Energy Efficiency through a Cleaner Production/Environmental Management System Framework",1340,"China, Viet Nam, Czech Republic, Hungary, Slovak Republic, India, Global","Climate Change","Medium-size Project","United Nations Environment Programme","950,000","1,765,000",Completed,2001,"GEF Trust Fund",No,No,"GEF - 2"
"South Africa Wind Energy Programme (SAWEP), Phase I",1338,"South Africa","Climate Change","Full-size Project","United Nations Development Programme","2,000,000","10,339,000",Completed,2007,"GEF Trust Fund",No,No,"GEF - 3"
"Promoting Energy Conservation in Small and Medium Scale Enterprises (PECSME)",1336,"Viet Nam","Climate Change","Full-size Project","United Nations Development Programme","5,469,000","23,428,250",Completed,2005,"GEF Trust Fund",No,No,"GEF - 3"
"Bioenergy for Sustainable Rural Development",1335,Egypt,"Climate Change","Full-size Project","United Nations Development Programme","3,000,000","12,390,000",Completed,2008,"GEF Trust Fund",Yes,No,"GEF - 3"
"Enabling activities to facilitate early action on the implementation of the Stockholm Convention on Persistent Organic Pollutants (POPs) in the Czech Republic",1332,"Czech Republic","Chemicals and Waste","Enabling Activity","United Nations Industrial Development Organization","440,733",,Completed,2001,"GEF Trust Fund",No,No,"GEF - 2"
"Demonstrating Cost-effectiveness and Sustainability of Environmentally-sound and Locally Appropriate Alternatives to DDT for Malaria Control in Africa",1331,"Madagascar, Eritrea, Ethiopia, Regional","Chemicals and Waste","Full-size Project","United Nations Environment Programme","3,460,296","2,966,950",Completed,2008,"GEF Trust Fund",No,No,"GEF - 3"
"Sustainable Land Management in the Zambian Miombo Woodland Ecosystem",1330,Zambia,,"Medium-size Project","The World Bank","747,000","603,000",Completed,2001,"GEF Trust Fund",No,No,"GEF - 2"
"Land Degradation Assessment in Drylands (LADA)",1329,Global,"Land Degradation","Full-size Project","United Nations Environment Programme","7,000,000","7,980,000",Completed,2005,"GEF Trust Fund",No,No,"GEF - 3"
"Barriers and Best Practices in Integrated Management of Mountain Ecosystems",1328,Global,Biodiversity,"Medium-size Project","United Nations Environment Programme","900,000","1,199,000",Completed,2002,"GEF Trust Fund",No,No,"GEF - 2"
"Institutional Strengthening and Resource Mobilization for Mainstreaming Integrated Land and Water Management Approaches into Development Programs in Africa",1325,"Niger, Ethiopia, Madagascar, Regional",,"Medium-size Project","The World Bank","1,000,000","300,000",Completed,2001,"GEF Trust Fund",No,No,"GEF - 2"
"Hai River Basin Integrated Water Resources Management",1323,China,"International Waters","Full-size Project","The World Bank","17,000,000","112,991,800",Completed,2004,"GEF Trust Fund",No,No,"GEF - 3"
"Conservation of Biodiversity in the Central Zagros Landscape Conservation Zone",1322,Iran,Biodiversity,"Full-size Project","United Nations Development Programme","3,800,000","5,775,000",Completed,2005,"GEF Trust Fund",No,No,"GEF - 3"
"Conservation and Sustainable Utilization of Wild Relatives of Crops (resubmission from Feb 2006 IWP)",1319,China,Biodiversity,"Full-size Project","United Nations Development Programme","7,850,000","13,112,000",Completed,2006,"GEF Trust Fund",No,No,"GEF - 3"
"Reducing Greenhouse Gas Emissions through the Use of Biomass Energy in Northwest Slovakia",1318,"Slovak Republic","Climate Change","Medium-size Project","United Nations Development Programme","973,500","7,344,304",Completed,2001,"GEF Trust Fund",No,No,"GEF - 2"
"Coastal Biodiversity Management of DPR Korea's West Sea",1317,"Korea DPR",Biodiversity,"Medium-size Project","United Nations Development Programme","774,523","540,990",Completed,2002,"GEF Trust Fund",No,No,"GEF - 2"
"Energy Efficiency Co-Financing Program 2 (HEECP2)",1316,Hungary,"Climate Change","Medium-size Project","The World Bank, International Finance Corporation","700,000","93,200,000",Completed,2001,"GEF Trust Fund",Yes,No,"GEF - 2"
"Global Promotion of Youth-Led Enterprises in Off-Grid Renewable Energy with Applications",1315,Global,"Climate Change","Medium-size Project","The World Bank","800,000","563,000",Completed,2001,"GEF Trust Fund",No,No,"GEF - 2"
"Management and Conservation of Wetland Biodiversity in the Esteros del Ibera",1312,Argentina,Biodiversity,"Medium-size Project","United Nations Development Programme","975,000","9,394,125",Completed,2002,"GEF Trust Fund",No,No,"GEF - 3"
"Pilot Production and Commercial Dissemination of Solar Cookers",1311,"South Africa","Climate Change","Medium-size Project","United Nations Development Programme","800,000","2,850,000",Completed,2001,"GEF Trust Fund",No,No,"GEF - 2"
"Building Wider Public and Private Constituences for the GEF in Latin America and the Caribbean: Regional Promotion of Global Environment Protection through the Electronic Media",1310,"Belize, St. Kitts And Nevis, Colombia, Barbados, Venezuela, Nicaragua, Mexico, Dominican Republic, El Salvador, Peru, Jamaica, Brazil, Chile, Bahamas, St. Lucia, Paraguay, St. Vincent and Grenadines, Guyana, Grenada, Uruguay, Antigua and Barbuda, Regional",,"Medium-size Project","United Nations Development Programme","998,062","959,132",Completed,2001,"GEF Trust Fund",No,No,"GEF - 2"
"Strategic Planning and Design for the Environmental Protection and Sustainable Development of Mexico",1308,Mexico,,"Medium-size Project","United Nations Development Programme","652,800","640,000",Completed,2001,"GEF Trust Fund",No,No,"GEF - 2"
"In-situ Conservation of Native Landraces and their Wild Relatives in Vietnam",1307,"Viet Nam",Biodiversity,"Medium-size Project","United Nations Development Programme","904,000","2,999,430",Completed,2001,"GEF Trust Fund",No,No,"GEF - 2"
