"Enabling China to Prepare Its Second National Communications to UNFCCC",3100,China,"Climate Change","Full-size Project","United Nations Development Programme","5,000,000","650,000",Completed,2008,"GEF Trust Fund",No,No,"GEF - 4"
"Market Transformation of Energy-Efficient Bricks and Rural Buildings (MTEBRB)",3091,China,"Climate Change","Full-size Project","United Nations Development Programme","7,000,000","45,362,118",Completed,2009,"GEF Trust Fund",No,No,"GEF - 4"
"Safe Management and Disposal of PCBs, Pillar I",3082,Morocco,"Chemicals and Waste","Full-size Project","United Nations Development Programme","2,198,000","5,173,200",Completed,2008,"GEF Trust Fund",No,No,"GEF - 4"
"Capacity Development for Improved National and International Environmental Management in Seychelles",3074,Seychelles,,"Medium-size Project","United Nations Development Programme","400,000","100,000",Completed,2009,"GEF Trust Fund",No,No,"GEF - 4"
"Developing Policy Relevant Capacity for Implementation of the Global Environmental Conventions in Jordan",3070,Jordan,,"Medium-size Project","United Nations Development Programme","475,000","500,000",Completed,2008,"GEF Trust Fund",No,No,"GEF - 4"
"Strengthening Capacity to Integrate Environment and Natural Resource Management for Global Environmental Benefits",3069,Romania,,"Medium-size Project","United Nations Development Programme","470,000","730,000",Completed,2008,"GEF Trust Fund",No,No,"GEF - 4"
"Mainstreaming the Multilateral Environmental Agreements into the Country's  Environmental Legislation",3068,Nicaragua,,"Medium-size Project","United Nations Development Programme","465,000","133,700",Completed,2008,"GEF Trust Fund",No,No,"GEF - 4"
"Strengthening Socotra's Policy and Regulatory Framework for Mainstreaming Biodiversity",3067,Yemen,Biodiversity,"Medium-size Project","United Nations Development Programme","975,000","1,750,000",Completed,2008,"GEF Trust Fund",No,No,"GEF - 4"
"Strengthening Institutional Capacities for Coordinating Multi-Sectoral Environmental Policies and Programmes",3062,Belize,,"Medium-size Project","United Nations Development Programme","472,500","152,400",Completed,2008,"GEF Trust Fund",No,No,"GEF - 4"
"Supporting Capacity Building for the Third National Reporting to CRIC-5/COP-8",3060,"Asia/Pacific, Latin America and Caribbean, Europe and Central Asia, Global","Land Degradation","Medium-size Project","International Fund for Agricultural Development","637,200","506,000",Completed,2006,"GEF Trust Fund",No,No,"GEF - 3"
"National Capacity Needs Self-Assessment for Global Environment Management (NCSA)",3058,Malaysia,,"Enabling Activity","United Nations Development Programme","170,000",,Completed,2006,"GEF Trust Fund",No,No,"GEF - 3"
"National Capacity Needs Self-Assessment for Global Environmental Needs (NCSA)",3056,Brazil,,"Enabling Activity","United Nations Development Programme","170,000",,Completed,2006,"GEF Trust Fund",No,No,"GEF - 3"
"Strengthening Coordination for Effective Environmental Management (STREEM)",3054,Philippines,,"Medium-size Project","United Nations Development Programme","475,000","515,000",Completed,2009,"GEF Trust Fund",No,No,"GEF - 4"
"Enhancing Global Environmental Management in Bhutan's Local Governance System",3052,Bhutan,,"Medium-size Project","United Nations Development Programme","475,000","222,692",Completed,2008,"GEF Trust Fund",No,No,"GEF - 4"
"Piloting Natural Resource Valuation within Environmental Impact Assessments",3049,Jamaica,,"Medium-size Project","United Nations Development Programme","470,250","132,000",Completed,2008,"GEF Trust Fund",No,No,"GEF - 4"
"Development of a National Plan for Implementation of the Stockholm Convention on POPs in Zambia - POPs enabling activities ""add on""",3048,Zambia,"Chemicals and Waste","Enabling Activity","United Nations Environment Programme","58,738",,Completed,2006,"GEF Trust Fund",No,No,"GEF - 3"
"BS Implementation of the National Biosafety Framework for Ghana",3045,Ghana,Biodiversity,"Medium-size Project","United Nations Environment Programme","636,364","800,000",Completed,2012,"GEF Trust Fund",No,No,"GEF - 4"
"Open Africa North South Tourism Corridor (OANSTC)",3044,"Namibia, Zambia, Regional",Biodiversity,"Medium-size Project","The World Bank","540,000","632,000",Completed,2008,"GEF Trust Fund",No,No,"GEF - 4"
"Support to the Implementation of the National Biosafety Framework",3043,Moldova,Biodiversity,"Medium-size Project","United Nations Environment Programme","542,350","147,000",Completed,2006,"GEF Trust Fund",No,No,"GEF - 3"
"BS: Support the Implementation of the National Biosafety Framework of Liberia",3040,Liberia,Biodiversity,"Medium-size Project","United Nations Environment Programme","577,679","530,000",Completed,2011,"GEF Trust Fund",No,No,"GEF - 4"
"Conservation and Use of Crop Genetic Diversity to Control Pests and Diseases in Support of Sustainable Agriculture (Phase 1)",3037,"Ecuador, Morocco, Uganda, China, Global",Biodiversity,PFD,"United Nations Environment Programme","3,411,148","4,274,344",Completed,2007,"GEF Trust Fund",No,No,"GEF - 3"
"Supporting Capacity Building for the Third National Reporting to CRIC-5/COP-8",3036,"Asia/Pacific, Global","Land Degradation","Medium-size Project","United Nations Development Programme","513,000","452,000",Completed,2006,"GEF Trust Fund",No,No,"GEF - 3"
"Environmental Remediation of Dioxin Contaminated Hotspots in Vietnam",3032,"Viet Nam","Chemicals and Waste","Full-size Project","United Nations Development Programme","4,977,000","32,335,550",Completed,2009,"GEF Trust Fund",No,No,"GEF - 4"
"SFM Safeguarding and Restoring Lebanon's Woodland Resources",3028,Lebanon,"Land Degradation","Medium-size Project","United Nations Development Programme","980,000","1,275,000",Completed,2008,"GEF Trust Fund",No,No,"GEF - 4"
"Support to Sustainable Transport Management in Dushanbe",3027,Tajikistan,"Climate Change","Medium-size Project","United Nations Development Programme","970,000","5,861,127",Completed,2009,"GEF Trust Fund",No,No,"GEF - 4"
"Support to the Implementation of the National Biosafety Framework of Slovakia",3023,"Slovak Republic",Biodiversity,"Medium-size Project","United Nations Environment Programme","466,000","139,000",Completed,2006,"GEF Trust Fund",No,No,"GEF - 3"
"FC-1: Sub-project 1st Group/Plug Power - under the Global Fuel Cells Financing Initiative for Distributed Generation Applications (Phase 1)",3022,"South Africa","Climate Change","Full-size Project","The World Bank, International Finance Corporation","3,275,000","10,325,000",Completed,2005,"GEF Trust Fund",No,No,"GEF - 3"
"Mainstreaming Biodiversity Conservation into the Operation of the Tourism and Fisheries Sectors in the Archipelagos of Panama",3021,Panama,Biodiversity,"Full-size Project","United Nations Development Programme","1,727,066","3,000,000",Completed,2010,"GEF Trust Fund",No,No,"GEF - 4"
"Support the Implementation of the National Biosafety Framework",3012,Tanzania,Biodiversity,"Medium-size Project","United Nations Environment Programme","777,300","614,300",Completed,2006,"GEF Trust Fund",No,No,"GEF - 3"
"Introduction of BAT and BEP methodology to demonstrate reduction or elimination of unintentionally produced POPs releases from the industry in Vietnam",3011,"Viet Nam","Chemicals and Waste","Medium-size Project","United Nations Industrial Development Organization","750,000","1,590,000",Completed,2008,"GEF Trust Fund",No,No,"GEF - 4"
"LGGE: Energy Efficiency in New Construction in the Residential and Commercial Buildings Sector in Mongolia",3010,Mongolia,"Climate Change","Medium-size Project","United Nations Development Programme","975,000","2,840,000",Completed,2009,"GEF Trust Fund",No,No,"GEF - 4"
"CleanTech Fund",3005,"Mexico, Brazil, Nicaragua, Panama, Regional","Climate Change","Medium-size Project","Inter-American Development Bank","995,000","61,200,000",Completed,2006,"GEF Trust Fund",Yes,No,"GEF - 3"
"SFM: Sustainable Management of the Miombo Woodland Resources of Western Tanzania",3000,Tanzania,"Biodiversity, Climate Change, Land Degradation","Full-size Project","United Nations Development Programme","2,745,000","13,766,666",Completed,2011,"GEF Trust Fund",No,No,"GEF - 4"
"National Capacity Needs Self-Assessment for Global Environmental Management",2998,Paraguay,,"Enabling Activity","United Nations Development Programme","200,000",,Completed,2006,"GEF Trust Fund",No,No,"GEF - 3"
"Implementation of the National Biosafety Framework",2997,"Viet Nam",Biodiversity,"Medium-size Project","United Nations Environment Programme","997,800","637,000",Completed,2006,"GEF Trust Fund",No,No,"GEF - 3"
"Portfolio Approach to Distributed Generation Opportunity (PADGO) (Phase 1)",2996,"Sri Lanka","Climate Change","Full-size Project","The World Bank, International Finance Corporation","3,600,000","18,781,537",Completed,2008,"GEF Trust Fund",No,No,"GEF - 3"
"Demonstrating and Promoting Best Techniques and Practices for Managing Healthcare Waste and PCBs",2995,Tunisia,"Chemicals and Waste","Full-size Project","The World Bank","5,500,000","11,200,000",Completed,2010,"GEF Trust Fund",No,No,"GEF - 4"
"WB/GEF POL: Second Shandong Environment - under WB/GEF Partnership Investment Fund for Pollution Reduction in the LME of East Asia",2979,China,"International Waters","Full-size Project","The World Bank","5,000,000","201,500,000",Completed,2007,"GEF Trust Fund",No,No,"GEF - 3"
"Mindanao Rural Development Program Phase II - Natural Resource Management Project",2975,Philippines,"Biodiversity, Land Degradation","Full-size Project","The World Bank","6,351,000","10,247,000",Completed,2009,"GEF Trust Fund",No,No,"GEF - 4"
"PCB Management Project",2974,"Viet Nam","Chemicals and Waste","Full-size Project","The World Bank","7,000,000","10,500,000",Completed,2009,"GEF Trust Fund",No,No,"GEF - 4"
"WB/GEF POL: Liaoning Medium Cities Infrastructure - under WB/GEF Partnership Investment Fund for Pollution Reduction in the LME of East Asia",2972,China,"International Waters","Full-size Project","The World Bank","5,000,000","187,700,000",Completed,2007,"GEF Trust Fund",No,No,"GEF - 3"
"DBSB: Integrated Nutrient Pollution Control Project-under the WB-GEF Investment Fund for Nutrient Reduction in the Danube River and Black Sea",2970,Romania,"International Waters","Full-size Project","The World Bank","5,500,000","76,100,000",Completed,2007,"GEF Trust Fund",No,No,"GEF - 2"
"Partnerships for Conservation Management of the Aketajawe-Lolobata National Park, North Maluku Province",2969,Indonesia,Biodiversity,"Medium-size Project","The World Bank","999,954","1,085,596",Completed,2007,"GEF Trust Fund",No,No,"GEF - 4"
"BS Regional Project for Implementing National Biosafety Frameworks in the Caribbean Sub-region - under the GEF Biosafety Program",2967,"St. Kitts And Nevis, Trinidad and Tobago, St. Lucia, Bahamas, Guyana, Dominica, Antigua and Barbuda, Grenada, Belize, St. Vincent and Grenadines, Barbados, Suriname, Regional",Biodiversity,"Full-size Project","United Nations Environment Programme","5,972,493","6,897,582",Completed,2011,"GEF Trust Fund",No,No,"GEF - 4"
"Bus Rapid Transit and Pedestrian Improvements in Jakarta",2954,Indonesia,"Climate Change","Full-size Project","United Nations Environment Programme","5,812,000","187,975,000",Completed,2006,"GEF Trust Fund",No,No,"GEF - 3"
"Thermal Power Efficiency",2952,China,"Climate Change","Full-size Project","The World Bank","19,700,000","89,260,000",Completed,2009,"GEF Trust Fund",No,No,"GEF - 4"
"Energy Efficiency Financing",2951,China,"Climate Change","Full-size Project","The World Bank","13,500,000","580,100,000",Completed,2008,"GEF Trust Fund",No,No,"GEF - 4"
"Lighting the ""Bottom of the Pyramid""",2950,"Ghana, Kenya, Regional","Climate Change","Full-size Project","The World Bank, International Finance Corporation","5,400,000","6,750,000",Completed,2007,"GEF Trust Fund",No,No,"GEF - 3"
"Critical Ecosystems Partnership Fund (CEPF), Phase 2",2949,Global,Biodiversity,"Full-size Project","The World Bank","20,000,000","80,000,000",Completed,2007,"GEF Trust Fund",No,No,"GEF - 3"
"Biodiversity Conservation Project",2948,"Sierra Leone",Biodiversity,"Full-size Project","The World Bank","5,000,000","18,800,000",Completed,2009,"GEF Trust Fund",No,No,"GEF - 3"
"Renewable Energy and Rural Electricity Access (RERA)",2947,Mongolia,"Climate Change","Full-size Project","The World Bank","3,500,000","19,500,000",Completed,2006,"GEF Trust Fund",No,No,"GEF - 3"
"Coal Fired Generation Rehabilitation Project",2946,India,"Climate Change","Full-size Project","The World Bank","45,400,000","258,000,000",Completed,2009,"GEF Trust Fund",No,No,"GEF - 3"
"Sustainable Energy Financing",2944,"Papua New Guinea, Solomon Islands, Vanuatu, Marshall Islands, Fiji, Regional","Climate Change","Full-size Project","The World Bank, International Finance Corporation","9,480,000","48,985,131",Completed,2007,"GEF Trust Fund",Yes,No,"GEF - 3"
"Promote Energy Efficiency in Buildings",2942,Türkiye,"Climate Change","Full-size Project","United Nations Development Programme","2,620,000","14,960,000",Completed,2010,"GEF Trust Fund",No,No,"GEF - 4"
"Market Transformation for Energy Efficiency in Buildings",2941,Brazil,"Climate Change","Full-size Project","United Nations Development Programme, Inter-American Development Bank","13,500,000","122,774,000",Completed,2009,"GEF Trust Fund",Yes,No,"GEF - 4"
"Solar Water Heating Market Transformation and Strengthening Initiative, Phase 1",2939,Global,"Climate Change","Full-size Project","United Nations Development Programme, United Nations Environment Programme","12,000,000","24,247,000",Completed,2008,"GEF Trust Fund",Yes,No,"GEF - 3"
"Micro-turbine Cogeneration Technology Application Project (MCTAP)",2935,Indonesia,"Climate Change","Full-size Project","United Nations Development Programme","2,587,300","15,333,000",Completed,2008,"GEF Trust Fund",No,No,"GEF - 4"
"SFM Catalyzing the Contribution of Indigenous Lands to the Conservation of Brazil's Forest Ecosystems",2934,Brazil,Biodiversity,"Full-size Project","United Nations Development Programme","6,000,000","30,742,665",Completed,2009,"GEF Trust Fund",No,No,"GEF - 4"
"Alternatives to DDT Usage for the Production of Anti-fouling Paint",2932,China,"Chemicals and Waste","Full-size Project","United Nations Development Programme","10,365,000","12,250,000",Completed,2007,"GEF Trust Fund",No,No,"GEF - 3"
"Adaptation to Climate Change through Effective Water Governance",2931,Ecuador,"Climate Change","Full-size Project","United Nations Development Programme","3,000,000","16,185,432",Completed,2008,"Special Climate Change Fund",No,No,"GEF - 4"
"Reducing Conflicting Water Uses in the Artibonite River Basin through Development and Adoption of a Multi-focal Area Strategic Action Programme",2929,"Dominican Republic, Haiti, Regional","International Waters, Land Degradation","Full-size Project","United Nations Development Programme","3,080,000","7,180,000",Completed,2009,"GEF Trust Fund",No,No,"GEF - 4"
"Environmentally Sustainable Management of Medical Waste in China",2927,China,"Chemicals and Waste","Full-size Project","United Nations Industrial Development Organization","11,650,000","33,157,140",Completed,2007,"GEF Trust Fund",No,No,"GEF - 4"
"Environmentally Sound Management and Disposal of Obsolete POPs Pesticides and Other POPs Wastes",2926,China,"Chemicals and Waste, Chemicals and Waste","Full-size Project","United Nations Industrial Development Organization","9,959,000","32,100,000",Completed,2009,"GEF Trust Fund",No,No,"GEF - 4"
"Development, Empowerment and Conservation in the Greater St Lucia Wetland Park and Surrounding Region",2924,"South Africa",Biodiversity,"Full-size Project","The World Bank","9,000,000","12,700,000",Completed,2009,"GEF Trust Fund",No,No,"GEF - 4"
"Electricity Sector Efficiency Improvement Project",2921,Guinea,"Climate Change","Full-size Project","The World Bank","4,500,000","9,200,000",Completed,2007,"GEF Trust Fund",No,No,"GEF - 3"
"Sustainable Energy Development Project (SEDP)",2918,Rwanda,"Climate Change","Full-size Project","The World Bank","4,500,000","66,760,000",Completed,2009,"GEF Trust Fund",No,No,"GEF - 3"
"Initial assistance to enable Trinidad and Tobago to fulfill its obligations under the Stockholm Convention on POPs",2916,"Trinidad and Tobago","Chemicals and Waste","Enabling Activity","United Nations Development Programme","425,500",,Completed,2006,"GEF Trust Fund",No,No,"GEF - 3"
"CPP Namibia: Adapting to Climate Change through the Improvement of Traditional Crops and Livestock Farming (SPA)",2915,Namibia,"Climate Change","Medium-size Project","United Nations Development Programme","960,000","5,795,806",Completed,2007,"GEF Trust Fund",No,No,"GEF - 3"
"Human-Wildlife-Coexistence Management Project in Northern Botswana.",2913,Botswana,Biodiversity,"Full-size Project","The World Bank","5,500,000","14,970,000",Completed,2009,"GEF Trust Fund",No,No,"GEF - 3"
"West African Regional Biosafety Program",2911,"Senegal, Togo, Burkina Faso, Benin, Mali, Regional",Biodiversity,"Full-size Project","The World Bank","5,400,000","18,900,000",Completed,2007,"GEF Trust Fund",No,No,"GEF - 3"
"Development of National Implementation Plans for the Management of Persistent Organic Pollutants - Mali ""add-on""",2909,Mali,"Chemicals and Waste","Enabling Activity","United Nations Environment Programme","88,450",,Completed,2005,"GEF Trust Fund",No,No,"GEF - 3"
"Re-engineering the National Protected Area System in Order to Achieve Financial Sustainability",2907,"Dominican Republic",Biodiversity,"Full-size Project","United Nations Development Programme","3,200,000","8,622,000",Completed,2009,"GEF Trust Fund",No,No,"GEF - 4"
"Tanzania Energy Development and Access Project (TEDAP)",2903,Tanzania,"Climate Change","Full-size Project","The World Bank","6,500,000","53,100,000",Completed,2007,"GEF Trust Fund",No,No,"GEF - 3"
"Design and Implementation of Pilot Climate Change Adaptation Measures in the Andean Region",2902,"Peru, Bolivia, Ecuador, Regional","Climate Change","Full-size Project","The World Bank","7,940,000","25,232,000",Completed,2008,"Special Climate Change Fund",No,No,"GEF - 4"
"GEF- Development Marketplace Partnership",2900,Global,,"Full-size Project","The World Bank","5,000,000","7,600,000",Completed,2006,"GEF Trust Fund",No,No,"GEF - 3"
"Country Support Program for GEF Focal Points",2899,Global,,"Full-size Project","United Nations Development Programme, United Nations Environment Programme","11,864,902","270,000",Completed,2006,"GEF Trust Fund",No,No,"GEF - 3"
"Sacred Orchids of Chiapas: Cultural and Religious Values in Conservation",2896,Mexico,Biodiversity,"Medium-size Project","The World Bank","837,392","1,173,746",Completed,2007,"GEF Trust Fund",No,No,"GEF - 4"
"Zambezi Valley Market Led Smallholder Development",2889,Mozambique,"Climate Change, Land Degradation","Full-size Project","The World Bank","6,200,000","21,200,000",Completed,2007,"GEF Trust Fund",No,No,"GEF - 3"
"Development of National Implementation Plans for the Management of POPs - Ecuador ""add-on""",2887,Ecuador,"Chemicals and Waste","Enabling Activity","United Nations Environment Programme","45,000",,Completed,2005,"GEF Trust Fund",No,No,"GEF - 3"
"Energy Development and Access Project (formerly) Development of Renewable Energy and Energy Efficiency",2886,Ghana,"Climate Change","Full-size Project","The World Bank","5,500,000","41,270,000",Completed,2007,"GEF Trust Fund",No,No,"GEF - 3"
"Mainstreaming Market-based Instruments for Environmental Management Project",2884,"Costa Rica",Biodiversity,"Full-size Project","The World Bank","10,000,000","80,310,000",Completed,2006,"GEF Trust Fund",No,No,"GEF - 3"
"Integrated Management of Marine and Coastal Resources in Puntarenas",2881,"Costa Rica",Biodiversity,"Full-size Project","Inter-American Development Bank","3,000,000","8,813,000",Completed,2010,"GEF Trust Fund",No,No,"GEF - 4"
"Development of National Implementation Plans for the Management of Persistent Organic Pollutants - ADD ON",2879,Guinea,"Chemicals and Waste","Enabling Activity","United Nations Environment Programme","75,000",,Completed,2005,"GEF Trust Fund",No,No,"GEF - 3"
"SPWA-CC: Ouagadougou Transport Modal Shift",2876,"Burkina Faso","Climate Change","Medium-size Project","The World Bank","909,000","3,590,000",Completed,2010,"GEF Trust Fund",No,No,"GEF - 4"
"Demonstration project for Phasing-out and Elimination of PCBs and PCB-Containing Equipment",2875,"North Macedonia","Chemicals and Waste","Medium-size Project","United Nations Industrial Development Organization","957,000","1,785,000",Completed,2008,"GEF Trust Fund",No,No,"GEF - 4"
"Environmentally Sound Disposal of PCBs Containing Equipment and Waste",2872,Latvia,"Chemicals and Waste, Chemicals and Waste","Medium-size Project","United Nations Development Programme","999,600","1,842,096",Completed,2006,"GEF Trust Fund",No,No,"GEF - 3"
"A Policy Forum of Power Sector Regulatory Frameworks for On-grid Renewable Energies",2871,Global,"Climate Change","Medium-size Project","The World Bank","1,000,000","750,000",Completed,2005,"GEF Trust Fund",No,No,"GEF - 3"
"Market Transformation for Efficient Biomass Stoves for Institutions and Small and Medium-Scale Enterprises",2870,Kenya,"Climate Change","Medium-size Project","United Nations Development Programme","975,000","5,646,467",Completed,2006,"GEF Trust Fund",No,No,"GEF - 3"
"The Development of a National Implementation Plan for  Cape Verde",2869,"Cabo Verde","Chemicals and Waste","Enabling Activity","United Nations Environment Programme","303,100",,Completed,2005,"GEF Trust Fund",No,No,"GEF - 3"
"Promotion of Strategies to Reduce Unintentional Production of POPs in the PERSGA Coastal Zone",2865,"Jordan, Yemen, Egypt, Sudan, Regional","Chemicals and Waste","Medium-size Project","United Nations Industrial Development Organization","950,000","2,030,000",Completed,2008,"GEF Trust Fund",No,No,"GEF - 4"
"Accruing Multiple Global Benefits through Integrated Water Resources Management/ Water Use Efficiency Planning: A Demonstration Project for Sub-Saharan Africa",2864,Botswana,"International Waters","Medium-size Project","United Nations Development Programme","975,000","11,820,000",Completed,2008,"GEF Trust Fund",No,No,"GEF - 4"
"Ensuring Impacts from SLM - Development of a Global Indicator System",2863,Global,"Land Degradation","Medium-size Project","United Nations Development Programme","952,550",,Completed,2007,"GEF Trust Fund",No,No,"GEF - 4"
"Mainstreaming Biodiversity Conservation into Tourism through the Development and Dissemination of Best Practices",2861,"Ecuador, Belize, Regional",Biodiversity,"Medium-size Project","United Nations Environment Programme","972,272","1,310,702",Completed,2005,"GEF Trust Fund",No,No,"GEF - 3"
"Knowledge Base for Lessons Learned and Best Practices in the Management of Coral Reefs",2856,Global,Biodiversity,"Medium-size Project","United Nations Environment Programme","940,000","949,000",Completed,2005,"GEF Trust Fund",No,No,"GEF - 3"
"Updating of NBSAP, Preparation of 2nd National Reports, and Establishment of a National Clearing House Mechanism (CHM)",2854,"Korea DPR",Biodiversity,"Enabling Activity","United Nations Environment Programme","130,000",,Completed,2005,"GEF Trust Fund",No,No,"GEF - 3"
"Improved Conservation and Governance for Kenya Coastal Forest Protected Area System",2848,Kenya,Biodiversity,"Medium-size Project","United Nations Development Programme","800,000","2,290,000",Completed,2007,"GEF Trust Fund",No,No,"GEF - 4"
"Development of National Implementation Plans for the Management of Persistent Organic Pollutants - Bulgaria ""add-on""",2845,Bulgaria,"Chemicals and Waste","Enabling Activity","United Nations Environment Programme","143,820",,Completed,2005,"GEF Trust Fund",No,No,"GEF - 3"
"Energy Efficiency Improvements in the Indian Brick Industry",2844,India,"Climate Change","Medium-size Project","United Nations Development Programme","696,448","1,999,000",Completed,2008,"GEF Trust Fund",No,No,"GEF - 4"
"Assessment of Capacity Building Needs to Conserve Biological Diversity - Add on",2841,Namibia,Biodiversity,"Enabling Activity","United Nations Environment Programme","207,501",,Completed,2005,"GEF Trust Fund",No,No,"GEF - 3"
"Support for the Implementation of the National Biosafety Framework",2839,"Czech Republic",Biodiversity,"Medium-size Project","United Nations Environment Programme","452,400","1,432,600",Completed,2005,"GEF Trust Fund",No,No,"GEF - 3"
"Support for the Implementation of the National Biosafety Framework",2838,Lithuania,Biodiversity,"Medium-size Project","United Nations Environment Programme","687,400","404,000",Completed,2006,"GEF Trust Fund",No,No,"GEF - 3"
"Support the Implementation of the National Biosafety Framework",2837,Estonia,Biodiversity,"Medium-size Project","United Nations Environment Programme","669,000","284,000",Completed,2006,"GEF Trust Fund",No,No,"GEF - 3"
"Conservation and Sustainable use of Biodiversity in the Kazakhstani Sector of the Altai-Sayan Mountain Ecoregion",2836,Kazakhstan,Biodiversity,"Full-size Project","United Nations Development Programme","2,395,700","16,338,700",Completed,2006,"GEF Trust Fund",No,No,"GEF - 3"
"Mainstreaming Climate Change in Integrated Water Resources Management in Pangani River Basin",2832,Tanzania,"Climate Change","Medium-size Project","United Nations Development Programme","1,000,000","1,574,875",Completed,2006,"Special Climate Change Fund",No,No,"GEF - 3"
"Rural Electrification and Renewable Energy Development",2828,Nigeria,"Climate Change","Medium-size Project","The World Bank","1,000,000","9,000,000",Completed,2005,"GEF Trust Fund",No,No,"GEF - 3"
"Uruguay Wind Energy Programme (UWEP)",2826,Uruguay,"Climate Change","Medium-size Project","United Nations Development Programme","950,000","6,010,000",Completed,2007,"GEF Trust Fund",No,No,"GEF - 4"
