Title,ID,Countries,"Focal Areas",Type,Agencies,"GEF Grant",Cofinancing,Status,"Approval FY","Funding Source (indexed field)","Non-Grant Instrument (indexed field)","Capacity-building Initiative for Transparency","GEF Period"
"Support the urgent UN-brokered SAFER Salvage Operation to prevent an environmental, humanitarian and economic oil spill disaster in the southern Red Sea",11056,Yemen,Biodiversity,"Full-size Project","United Nations Development Programme","4,016,210","55,500,000",Completed,2023,"GEF Trust Fund",No,No,"GEF - 8"
"Preparation of the First Biennial Transparency Report (BTR)",10953,Panama,"Climate Change","Enabling Activity","United Nations Development Programme","484,000","125,000",Completed,2022,"GEF Trust Fund",No,No,"GEF - 7"
"Transforming the Fashion Sector to Drive Positive Outcomes for Biodiversity, Climate, and Oceans",10658,Global,"Climate Change, Chemicals and Waste","Medium-size Project","Conservation International","2,000,000","4,790,893",Completed,2020,"GEF Trust Fund",No,No,"GEF - 7"
"Development of Minamata Initial Assessment in The Bahamas",10585,Bahamas,"Chemicals and Waste","Enabling Activity","United Nations Environment Programme","150,000",,Completed,2020,"GEF Trust Fund",No,No,"GEF - 7"
"Mexico´s Third Biennial Update Report (BUR3)",10506,Mexico,"Climate Change","Enabling Activity","United Nations Development Programme","352,000","352,000",Completed,2020,"GEF Trust Fund",No,No,"GEF - 7"
"Colombia's Third Biennial Update Report (BUR-3)",10491,Colombia,"Climate Change","Enabling Activity","United Nations Development Programme","352,000","133,928",Completed,2020,"GEF Trust Fund",No,No,"GEF - 7"
"Fourth Biennial Update Report",10487,Chile,"Climate Change","Enabling Activity","United Nations Development Programme","352,000","36,168",Completed,2020,"GEF Trust Fund",No,No,"GEF - 7"
"Enabling Preparation of Nicaragua’s Fourth National Communication and First Biennial Update Report to UNFCCC",10450,Nicaragua,"Climate Change","Enabling Activity","Food and Agriculture Organization","852,000","443,400",Completed,2020,"GEF Trust Fund",No,No,"GEF - 7"
"Development of National Action Plan for Artisanal and Small-Scale Gold Mining in Chad",10448,Chad,"Chemicals and Waste","Enabling Activity","United Nations Environment Programme","500,000","10,000",Completed,2020,"GEF Trust Fund",No,No,"GEF - 7"
"National action plan on mercury in the artisanal and small-scale gold mining sector in Cameroon",10440,Cameroon,"Chemicals and Waste","Enabling Activity","United Nations Industrial Development Organization","500,000","46,500",Completed,2020,"GEF Trust Fund",No,No,"GEF - 7"
"Development of National Action Plan for the Artisanal and Small Scale Gold Mining in Costa Rica",10423,"Costa Rica","Chemicals and Waste","Enabling Activity","United Nations Environment Programme","500,000",,Completed,2020,"GEF Trust Fund",No,No,"GEF - 7"
"Staying within Sustainable Limits: Advancing leadership of the private sector and cities",10309,Global,"Biodiversity, Climate Change, Land Degradation","Medium-size Project","Conservation International","2,000,000","4,213,517",Completed,2019,"GEF Trust Fund",No,No,"GEF - 7"
"Adaptation SME Accelerator Project (ASAP)",10296,Global,"Climate Change","Medium-size Project","Conservation International","1,995,497","500,000",Completed,2019,"Special Climate Change Fund",No,No,"GEF - 7"
"Strengthening Land Degradation Neutrality data and decision-making through free and open access platforms",10230,Global,"Land Degradation","Enabling Activity","Conservation International","2,000,000","397,700",Completed,2019,"GEF Trust Fund",No,No,"GEF - 7"
"China Capacity Building for Enhanced Transparency Phase I",10227,China,"Climate Change","Medium-size Project","Foreign Economic Cooperation Office, Ministry of Environmental Protection of China","1,650,000","1,437,000",Completed,2020,"GEF Trust Fund",No,Yes,"GEF - 7"
"Namibia’s Fourth Biennial Update Report (BUR4) to the United Nations Framework Convention on Climate Change (UNFCCC)",10224,Namibia,"Climate Change","Enabling Activity","United Nations Development Programme","352,000","50,000",Completed,2019,"GEF Trust Fund",No,No,"GEF - 7"
"Development of Montenegro’s Third Biennial Update Report (TBUR) to the UNFCCC",10223,Montenegro,"Climate Change","Enabling Activity","United Nations Development Programme","352,000","50,000",Completed,2019,"GEF Trust Fund",No,No,"GEF - 7"
"Development of National Action Plan for Artisanal and Small Scale Gold Mining in the Co-operative Republic of Guyana",10153,Guyana,"Chemicals and Waste","Enabling Activity","United Nations Environment Programme","500,000",,Completed,2019,"GEF Trust Fund",No,No,"GEF - 7"
"Development of Fourth National Communication and Second Biennial Update Report under the UNFCCC",10146,Panama,"Climate Change","Enabling Activity","United Nations Development Programme","852,000","93,000",Completed,2019,"GEF Trust Fund",No,No,"GEF - 7"
"Armenia's Third Biennial Update Report to the UNFCCC",10145,Armenia,"Climate Change","Enabling Activity","United Nations Development Programme","352,000","55,000",Completed,2019,"GEF Trust Fund",No,No,"GEF - 7"
"Realising the potential of native microbes in the agricultural and medical sectors, in accordance with the Nagoya Protocol",10142,Panama,Biodiversity,"Medium-size Project","United Nations Development Programme","863,242","14,535,059",Completed,2020,"GEF Trust Fund",No,No,"GEF - 7"
"Development of Kazakhstan’s Eighth National Communication and preparation of two (Fourth and Fifth) Biennial Reports to the UNFCCC",10140,Kazakhstan,"Climate Change","Enabling Activity","United Nations Development Programme","852,000","916,768",Completed,2019,"GEF Trust Fund",No,No,"GEF - 7"
"Building Armenia’s national transparency framework under Paris Agreement",10138,Armenia,"Climate Change","Medium-size Project","United Nations Development Programme","990,000","570,000",Completed,2020,"GEF Trust Fund",No,Yes,"GEF - 7"
"Fourth National Communication (4NC) and Second Biennial Update Report (2BUR)",10137,Ecuador,"Climate Change","Enabling Activity","United Nations Development Programme","852,000","83,684",Completed,2019,"GEF Trust Fund",No,No,"GEF - 7"
"Thailand’s Fourth National Communication and Third Biennial Update Report (NC4-BUR3) to the UNFCCC",10131,Thailand,"Climate Change","Enabling Activity","United Nations Development Programme","852,000","700,000",Completed,2019,"GEF Trust Fund",No,No,"GEF - 7"
"Review and update of the national implementation plan for the Stockholm Convention on Persistent Organic Pollutants (POPs)",10130,Jamaica,"Chemicals and Waste","Enabling Activity","United Nations Development Programme","250,000",,Completed,2019,"GEF Trust Fund",No,No,"GEF - 7"
"Nigeria's Second Biennial Update Report (BUR2)",10127,"Regional, Nigeria","Climate Change","Enabling Activity","United Nations Development Programme","352,000","50,000",Completed,2018,"GEF Trust Fund",No,No,"GEF - 7"
"Strengthen institutional and technical capacities in the agricultural and forestry sectors of Nicaragua to respond to the requirements of the enhanced transparency framework under the Paris Agreement",10118,Nicaragua,"Climate Change","Medium-size Project","Food and Agriculture Organization","863,242","309,600",Completed,2020,"CBIT Trust Fund",No,Yes,"GEF - 7"
"Sustainable Natural Resources Management Project -AF",10083,Sudan,"Climate Change, Land Degradation","Full-size Project","The World Bank","5,936,073","17,600,000",Completed,2020,"Multi Trust Fund",No,No,"GEF - 7"
"Building global capacity to increase transparency in the forest sector (CBIT-Forest)",10071,Global,"Climate Change","Medium-size Project","Food and Agriculture Organization","1,686,320","5,200,000",Completed,2019,"CBIT Trust Fund",No,Yes,"GEF - 7"
"Fourth National Communication and Second Biennial Update Report under the UNFCCC",10068,"Regional, Jordan","Climate Change","Enabling Activity","United Nations Development Programme","852,000","90,000",Completed,2018,"GEF Trust Fund",No,No,"GEF - 7"
"Uruguay’s Third Biennial Update Report (BUR3)",10066,Regional,"Climate Change","Enabling Activity","United Nations Development Programme","319,000","91,000",Completed,2018,"GEF Trust Fund",No,No,"GEF - 7"
"Promoting Climate-smart Livestock Management in the Dominican Republic",10054,"Dominican Republic","Climate Change","Medium-size Project","Food and Agriculture Organization","1,540,585","8,141,408",Completed,2018,"GEF Trust Fund",No,No,"GEF - 6"
"Promoting a Better Access to Modern Energy Services through Sustainable Mini-grids and Hybrid Technologies in Djibouti",10051,Djibouti,"Climate Change","Medium-size Project","United Nations Development Programme","863,242","6,800,000",Completed,2019,"GEF Trust Fund",No,No,"GEF - 6"
"Water Funds A Conservation Climate Resilient Model for Stressed Watersheds in Latin America and the Caribbean",10048,"Brazil, Chile, Argentina, Colombia, Guatemala, Regional","Biodiversity, International Waters","Medium-size Project","Inter-American Development Bank","1,826,484","8,114,951",Completed,2018,"GEF Trust Fund",No,No,"GEF - 6"
"Third National Communication and First Biennial Update Report of Algeria to the UNFCCC",10045,"Algeria, Regional","Climate Change","Enabling Activity","United Nations Development Programme","852,000","2,400,000",Completed,2018,"GEF Trust Fund",No,No,"GEF - 6"
"Strengthening Institutional and Technical Macedonian Capacities to Enhance Transparency in the Framework of the Paris Agreement",10042,"North Macedonia","Climate Change","Medium-size Project","United Nations Development Programme","1,320,000","1,410,000",Completed,2019,"CBIT Trust Fund",No,Yes,"GEF - 6"
"Establishing Transparency Framework for the Republic of Serbia",10029,Serbia,"Climate Change","Medium-size Project","United Nations Development Programme","1,100,000","100,000",Completed,2019,"CBIT Trust Fund",No,Yes,"GEF - 6"
"Integrated Transparency Framework for Implementation of the Paris Agreement",10028,Georgia,"Climate Change","Medium-size Project","United Nations Environment Programme","1,000,000","452,340",Completed,2019,"CBIT Trust Fund",No,Yes,"GEF - 6"
"Fourth National Communication and Third Biennial Update Report on Climate Change under the UNFCCC",10024,"North Macedonia, Regional","Climate Change","Enabling Activity","United Nations Development Programme","852,000","350,000",Completed,2018,"GEF Trust Fund",No,No,"GEF - 6"
"Development of the National Framework for Climate Transparency of Panama",10023,Panama,"Climate Change","Medium-size Project","United Nations Environment Programme","850,000","150,000",Completed,2020,"CBIT Trust Fund",No,Yes,"GEF - 6"
"Strengthening Jamaica´s Capacity to Meet Transparency Requirements under the Paris Agreement",10014,Jamaica,"Climate Change","Medium-size Project","Inter-American Development Bank","1,300,000","180,500",Completed,2019,"CBIT Trust Fund",No,Yes,"GEF - 6"
"Fourth National Communication to the UNFCCC",10010,"Regional, Egypt","Climate Change","Enabling Activity","United Nations Development Programme","500,000","80,000",Completed,2018,"GEF Trust Fund",No,No,"GEF - 6"
"AVACLIM : Agro-ecology, Ensuring Food Security and Sustainable Livelihoods while Mitigating Climate Change and Restoring Land in Dryland Regions",9993,"Burkina Faso, India, South Africa, Ethiopia, Senegal, Brazil, Morocco, Global","Climate Change, Land Degradation","Medium-size Project","Food and Agriculture Organization","1,137,215","8,148,245",Completed,2019,"GEF Trust Fund",No,No,"GEF - 6"
"Development of Minamata Initial Assessments (MIA) in the Caribbean (Belize)",9991,Belize,"Chemicals and Waste","Enabling Activity","United Nations Environment Programme","150,000",,Completed,2018,"GEF Trust Fund",No,No,"GEF - 6"
"Lebanon’s Fourth National Communication and Third Biennial Update Report under the UNFCCC",9982,"Lebanon, Regional","Climate Change","Enabling Activity","United Nations Development Programme","852,000","60,000",Completed,2018,"GEF Trust Fund",No,No,"GEF - 6"
"Preparation of the Fourth National Communication (4NC) and of the Second Biennial Updated Report (2BUR) to the UNFCCC",9977,"Togo, Regional","Climate Change","Enabling Activity","United Nations Development Programme","852,000","330,000",Completed,2018,"GEF Trust Fund",No,No,"GEF - 6"
"Integrated Reporting and Transparency System",9966,Bosnia-Herzegovina,"Climate Change","Medium-size Project","United Nations Development Programme","1,200,000","250,000",Completed,2020,"CBIT Trust Fund",No,Yes,"GEF - 6"
"Long-term Financial Mechanism to Enhance Mediterranean MPA Management Effectiveness",9959,"Regional, Albania, Tunisia, Morocco","International Waters","Medium-size Project","Conservation International","908,275","9,692,183",Completed,2018,"GEF Trust Fund",No,No,"GEF - 6"
"Bangladesh: First Biennial Update Report (BUR1) to the UNFCCC",9957,"Regional, Bangladesh","Climate Change","Enabling Activity","United Nations Development Programme","352,000","137,000",Completed,2018,"GEF Trust Fund",No,No,"GEF - 6"
"Argentine Republic’s Third Biennial Update Report (BUR 3)",9952,"Argentina, Regional","Climate Change","Enabling Activity","United Nations Development Programme","352,000","63,922",Completed,2017,"GEF Trust Fund",No,No,"GEF - 6"
"Growing Green Business in Montenegro",9950,Montenegro,"Climate Change","Medium-size Project","United Nations Development Programme","771,690","4,643,490",Completed,2017,"GEF Trust Fund",No,No,"GEF - 6"
"Setting the Foundations for Zero Net Loss of the Mangroves that Underpin Human Wellbeing in the North Brazil Shelf LME",9949,"Regional, Guyana, Suriname","International Waters","Medium-size Project","Conservation International","592,202","838,259",Completed,2018,"GEF Trust Fund",No,No,"GEF - 6"
"Building and Strengthening Madagascar’s National Capacity to Implement the Transparency Elements of the Paris Agreement",9948,Madagascar,"Climate Change","Medium-size Project","Conservation International","1,344,495","180,590",Completed,2019,"CBIT Trust Fund",No,Yes,"GEF - 6"
"The SEforALL Building Efficiency Accelerator (BEA): Expanding Local Action and Driving National Change",9947,Global,"Climate Change","Medium-size Project","United Nations Environment Programme","2,000,000","6,116,597",Completed,2018,"GEF Trust Fund",No,No,"GEF - 6"
"Albania's First Biennial Update Report and Fourth National Communication under the UNFCCC",9945,"Albania, Regional","Climate Change","Enabling Activity","United Nations Development Programme","852,000","50,000",Completed,2018,"GEF Trust Fund",No,No,"GEF - 6"
"Structuring and Launching CRAFT: the First Private Sector Climate Resilience & Adaptation Fund for Developing Countries",9941,Global,"Climate Change","Medium-size Project","Conservation International","1,045,000","1,418,000",Completed,2017,"Special Climate Change Fund",No,No,"GEF - 6"
"Global Green Residential Housing Finance Program - (GreenHF)",9935,Global,"Climate Change","Medium-size Project","The World Bank","1,480,000","1,900,000",Completed,2018,"GEF Trust Fund",No,No,"GEF - 6"
"Clean Rural Electrification for African Countries",9931,Regional,"Climate Change","Medium-size Project","United Nations Development Programme","950,000","550,000",Completed,2018,"GEF Trust Fund",No,No,"GEF - 6"
"Preparation of the Seventh National Communication for the Implementation of the United Nations Framework Convention on Climate Change and the Third Biennial Report",9929,"Belarus, Regional","Climate Change","Enabling Activity","United Nations Development Programme","852,000","40,065",Completed,2017,"GEF Trust Fund",No,No,"GEF - 6"
"Sustainable Management of Kharga Oasis Agro-Ecosystems in the Egyptian Western Desert",9928,Egypt,"Biodiversity, Climate Change","Medium-size Project","Food and Agriculture Organization","1,045,890","9,000,000",Completed,2018,"GEF Trust Fund",No,No,"GEF - 6"
"Building and Strengthening Liberia’s National Capacity to Implement the Transparency Elements of the Paris Climate Agreement",9923,Liberia,"Climate Change","Medium-size Project","Conservation International","1,344,495","1,600,000",Completed,2018,"CBIT Trust Fund",No,Yes,"GEF - 6"
"Capacity Building for Emissions Trading and Strengthened MRV",9895,Belarus,"Climate Change","Medium-size Project","United Nations Development Programme","840,000","8,067,280",Completed,2018,"GEF Trust Fund",No,No,"GEF - 6"
"Minamata Initial Assessment for Argentina",9885,Argentina,"Chemicals and Waste","Enabling Activity","United Nations Development Programme","200,000",,Completed,2017,"GEF Trust Fund",No,No,"GEF - 6"
"Enhancing Legislative, Policy, and Criminal Justice Frameworks for Combating Poaching and Illegal Wildlife Trade in Africa",9882,"Malawi, Kenya, Mozambique, Gabon, Zambia, Regional",Biodiversity,"Medium-size Project","United Nations Environment Programme","1,000,000","1,105,000",Completed,2017,"GEF Trust Fund",No,No,"GEF - 6"
"Enhancing Financial Sustainability of the Protected Area System",9879,Georgia,Biodiversity,"Medium-size Project","United Nations Development Programme","1,826,484","7,958,516",Completed,2018,"GEF Trust Fund",No,No,"GEF - 6"
"Fourth National Communication and Third Biennial Update Report under the UNFCCC",9877,"Bosnia-Herzegovina, Regional","Climate Change","Enabling Activity","United Nations Development Programme","852,000","180,000",Completed,2017,"GEF Trust Fund",No,No,"GEF - 6"
"Colombia's Second Biennial Update Report (BUR2)",9871,"Colombia, Regional","Climate Change","Enabling Activity","United Nations Development Programme","352,000","42,752",Completed,2017,"GEF Trust Fund",No,No,"GEF - 6"
"Development of Minamata Initial Assessments (MIA) in the Caribbean (Antigua and Barbuda, Dominica, Grenada, St. Vincent and the Grenadines)",9865,"Regional, Antigua and Barbuda, Dominica, Grenada, St. Vincent and Grenadines","Chemicals and Waste","Enabling Activity","United Nations Environment Programme","600,000",,Completed,2017,"GEF Trust Fund",No,No,"GEF - 6"
"Global Capacity-building Towards Enhanced Transparency in the AFOLU Sector (CBIT-AFOLU)",9864,Global,"Climate Change","Medium-size Project","Food and Agriculture Organization","1,776,484","3,000,000",Completed,2018,"CBIT Trust Fund",No,Yes,"GEF - 6"
"Micronesia Public Sector Buildings Energy Efficiency (MPSBEE) Project",9863,Micronesia,"Climate Change","Medium-size Project","United Nations Development Programme","1,776,483","3,500,000",Completed,2019,"GEF Trust Fund",No,No,"GEF - 6"
"Supply Change: Promoting Reduction of Deforestation Impacts of Commodity Supply Chains",9858,Global,Biodiversity,"Medium-size Project","United Nations Environment Programme","1,000,000","2,000,000",Completed,2017,"GEF Trust Fund",No,No,"GEF - 6"
"First Biennial Update Report and Third National Communication on Climate Change",9844,"Guatemala, Regional","Climate Change","Enabling Activity","United Nations Development Programme","852,000","528,480",Completed,2017,"GEF Trust Fund",No,No,"GEF - 6"
"Support to Eligible Parties to Produce the Sixth National Report to the CBD (6NR - LAC-II)",9840,"Global, Cuba, Mexico, Uruguay, Trinidad and Tobago, Guatemala, Dominica, Brazil, Haiti, Suriname, Chile, Panama, Venezuela, Grenada",Biodiversity,"Medium-size Project","United Nations Development Programme","1,501,500","691,000",Completed,2017,"GEF Trust Fund",No,No,"GEF - 6"
"Namibia’s Third Biennial Update Report (BUR3) to the United Nations Framework Convention on Climate Change (UNFCCC)",9838,"Namibia, Regional","Climate Change","Enabling Activity","United Nations Development Programme","352,000","50,000",Completed,2017,"GEF Trust Fund",No,No,"GEF - 6"
"Strengthening Capacity in the Agriculture and Land-use Sectors for Enhanced Transparency in Implementation and Monitoring of Cambodia’s Nationally Determined Contribution (NDC)",9837,Cambodia,"Climate Change","Medium-size Project","Food and Agriculture Organization","863,242","2,131,331",Completed,2018,"CBIT Trust Fund",No,Yes,"GEF - 6"
"Strengthening Chile’s Nationally Determined Contribution (NDC) Transparency Framework",9835,Chile,"Climate Change","Medium-size Project","United Nations Environment Programme","1,232,000","870,000",Completed,2018,"CBIT Trust Fund",No,Yes,"GEF - 6"
"Strengthening Capacity in the Agricultural and Land-use Sectors for Enhanced Transparency in Implementation and Monitoring of Mongolia’s Nationally Determined Contribution (NDC)",9834,Mongolia,"Climate Change","Medium-size Project","Food and Agriculture Organization","863,242","460,000",Completed,2018,"CBIT Trust Fund",No,Yes,"GEF - 6"
"Strengthening capacity in the agriculture and land-use sectors for enhanced transparency in implementation and monitoring of Nationally Determined Contributions (NDCs) under the Paris Agreement in Papua New Guinea",9833,"Papua New Guinea","Climate Change","Medium-size Project","Food and Agriculture Organization","863,242","2,600,000",Completed,2018,"CBIT Trust Fund",No,Yes,"GEF - 6"
"Third Biennial Update Report and Fourth National Communication under the UNFCCC",9831,"Chile, Regional","Climate Change","Enabling Activity","United Nations Development Programme","852,000","81,593",Completed,2017,"GEF Trust Fund",No,No,"GEF - 6"
"Support to Eligible Parties to Produce the Sixth National Report to the CBD (6NR - Mixed regions)",9829,"Global, Tunisia, Algeria, Jordan, Iraq, Morocco, Kyrgyz Republic, Bahamas, Turkmenistan, Mauritania, Kazakhstan, Uzbekistan, Lebanon, Yemen, Egypt, Afghanistan, Tajikistan, Barbados",Biodiversity,"Medium-size Project","United Nations Development Programme","1,963,500","1,822,500",Completed,2017,"GEF Trust Fund",No,No,"GEF - 6"
"Strengthening the Transparency System for Enhanced Climate Action in Côte d’Ivoire",9828,"Cote d'Ivoire","Climate Change","Medium-size Project","United Nations Development Programme","1,160,000","210,000",Completed,2019,"CBIT Trust Fund",No,Yes,"GEF - 6"
"Support to Eligible Parties to Produce the Sixth National Report (6NR) to the CBD (Asia)",9826,"Global, Indonesia, Malaysia, Lao PDR, Samoa, Bangladesh, Sri Lanka, Papua New Guinea, Philippines, Nepal, Myanmar, Thailand, Timor Leste, Bhutan, Cambodia, Viet Nam, India, China",Biodiversity,"Medium-size Project","United Nations Development Programme","1,963,500","2,148,902",Completed,2017,"GEF Trust Fund",No,No,"GEF - 6"
"Support to Eligible Parties to Produce the Sixth National Report to the CBD (LAC)",9821,"Regional, Costa Rica, Peru, Argentina, Dominican Republic, Guyana, St. Kitts And Nevis, El Salvador, Ecuador, Jamaica, Antigua and Barbuda, Paraguay, Honduras, Belize, Colombia, St. Lucia, St. Vincent and Grenadines, Bolivia",Biodiversity,"Medium-size Project","United Nations Development Programme","1,963,500","1,380,000",Completed,2017,"GEF Trust Fund",No,No,"GEF - 6"
"Strengthening Ghana’s National Capacity for Transparency and Ambitious Climate Reporting",9820,Ghana,"Climate Change","Medium-size Project","United Nations Environment Programme","1,100,000","1,177,500",Completed,2018,"CBIT Trust Fund",No,Yes,"GEF - 6"
"Third National Communication and First Biennial Update Report to the UNFCCC",9819,"Cuba, Regional","Climate Change","Enabling Activity","United Nations Development Programme","852,000","976,000",Completed,2017,"GEF Trust Fund",No,No,"GEF - 6"
"Second Biennial Update Report of Paraguay",9818,"Paraguay, Regional","Climate Change","Enabling Activity","United Nations Development Programme","352,000","55,000",Completed,2017,"GEF Trust Fund",No,No,"GEF - 6"
"Strengthening the Capacity of Institutions in Uganda to Comply with the Transparency Requirements of the Paris Agreement",9814,Uganda,"Climate Change","Medium-size Project","Conservation International","1,100,000","619,455",Completed,2018,"CBIT Trust Fund",No,Yes,"GEF - 6"
"The Global Cleantech Innovation Programme for SMEs",9811,Ukraine,"Climate Change","Medium-size Project","United Nations Industrial Development Organization","1,502,875","12,200,000",Completed,2018,"GEF Trust Fund",No,No,"GEF - 6"
"Global Deployment of the Industrial Energy Efficiency Accelerator",9807,Global,"Climate Change","Medium-size Project","United Nations Industrial Development Organization","2,000,000","6,810,000",Completed,2017,"GEF Trust Fund",No,No,"GEF - 6"
"Conservation and Sustainable Use of Biodiversity in Coastal Marine Production Landscapes",9804,Panama,Biodiversity,"Medium-size Project","United Nations Development Programme","1,780,822","5,603,208",Completed,2018,"GEF Trust Fund",No,No,"GEF - 6"
"Forest Resources Assessment and Monitoring to Strengthen Forest Knowledge Framework in Azerbaijan",9795,Azerbaijan,"Climate Change, Land Degradation","Medium-size Project","Food and Agriculture Organization","1,484,247","7,000,000",Completed,2017,"GEF Trust Fund",No,No,"GEF - 6"
"Aligning the Financial System and Infrastructure Investments with Sustainable Development - a Transformational Approach",9775,Global,"Climate Change","Medium-size Project","United Nations Environment Programme","2,000,000","3,245,000",Completed,2018,"GEF Trust Fund",No,No,"GEF - 6"
"GEF SGP Sixth Operational Phase- Strategic Implementation Using STAR Resources Tranche 1, Mainly in LDCs and SIDs (Part III)",9774,"Global, Malaysia, Gambia, Jamaica, Argentina, Panama, Nepal, Dominican Republic, Eritrea, Colombia, Belarus, Bhutan, Cabo Verde, Mali, Burkina Faso, Congo DR, Madagascar","Biodiversity, Climate Change, Land Degradation","Full-size Project","United Nations Development Programme","17,337,500","18,031,000",Completed,2017,"GEF Trust Fund",No,No,"GEF - 6"
"Improved Forested Landscape Management Project (GEF Additional Financing)",9760,"Congo DR","Biodiversity, Climate Change","Full-size Project","The World Bank","6,210,046","32,417,589",Completed,2019,"GEF Trust Fund",No,No,"GEF - 6"
