"Strengthening Climate Information and Early Warning Systems in Tanzania to Support Climate Resilient Development and Adaptation to Climate Change",4991,Tanzania,"Climate Change","Full-size Project","United Nations Development Programme","4,000,000","23,165,000",Completed,2013,"Least Developed Countries Fund",No,No,"GEF - 5"
"Community Disaster Risk Management in Burundi",4990,Burundi,"Climate Change","Full-size Project","United Nations Development Programme","8,715,000","27,000,000",Completed,2014,"Least Developed Countries Fund",No,No,"GEF - 5"
"National Biodiversity Planning to Support the Implementation of the CBD 2011-2020 Strategic Plan",4989,"Regional, Uzbekistan",Biodiversity,"Enabling Activity","United Nations Development Programme","220,000","300,000",Completed,2012,"GEF Trust Fund",No,No,"GEF - 5"
"National Biodiversity Planning to Support the implementation of the CBD 2011-2020 Strategic Plan in Algeria",4987,"Regional, Algeria",Biodiversity,"Enabling Activity","United Nations Development Programme","220,000","321,600",Completed,2012,"GEF Trust Fund",No,No,"GEF - 5"
"Reducing global and local environmental risks from primary mercury mining in Khaidarkan the Kyrgyz Republic",4985,"Kyrgyz Republic","Chemicals and Waste","Medium-size Project","United Nations Environment Programme","944,000","3,007,000",Completed,2012,"GEF Trust Fund",No,No,"GEF - 5"
"National Biodiversity Planning to Support the Implementation of the CBD 2011-2020 Strategic Plan",4982,"Regional, Croatia",Biodiversity,"Enabling Activity","United Nations Development Programme","220,000","72,960",Completed,2012,"GEF Trust Fund",No,No,"GEF - 5"
"National Biodiversity Planning to Support the implementation of the CBD 2011-2020 Strategic Plan",4981,"Regional, Philippines",Biodiversity,"Enabling Activity","United Nations Development Programme","220,000","506,200",Completed,2012,"GEF Trust Fund",No,No,"GEF - 5"
"National Biodiversity Planning to Support the Implementation of the CBD 2011-2020 Strategic Plan",4980,"Regional, Indonesia",Biodiversity,"Enabling Activity","United Nations Development Programme","450,000","991,000",Completed,2012,"GEF Trust Fund",No,No,"GEF - 5"
"National Biodiversity Planning to Support the Implementation of the CBD 2011-2020 Strategic Plan",4979,"Regional, Serbia",Biodiversity,"Enabling Activity","United Nations Development Programme","220,000","50,000",Completed,2012,"GEF Trust Fund",No,No,"GEF - 5"
"Addressing the Risk of Climate-induced Disasters through Enhanced National and Local Capacity for Effective Actions",4976,Bhutan,"Climate Change","Full-size Project","United Nations Development Programme","11,491,200","54,539,829",Completed,2014,"Least Developed Countries Fund",No,No,"GEF - 5"
"Enhancing Adaptive Capacity and Resilience to Climate Change in the Agriculture Sector in Comoros",4974,Comoros,"Climate Change","Full-size Project","United Nations Development Programme","8,990,890","38,309,621",Completed,2014,"Least Developed Countries Fund",No,No,"GEF - 5"
"Adapting Natural Resource Dependent Livelihoods to Climate induced Risks in Selected Landscaqpes in Burkina Faso: the Boucle du Mouhoun Forest Corridor and the Mare d'Oursi Wetlands Basin",4971,"Burkina Faso","Climate Change","Full-size Project","United Nations Development Programme","7,000,000","30,672,541",Completed,2014,"Least Developed Countries Fund",No,No,"GEF - 5"
"Integrated National Monitoring and Assessment System on Forest Ecosystems (SIMEF) in Support of Policies, Regulations and SFM Practices Incorporating REDD+ and Biodiversity Conservation in Forest Ecosystems",4968,Chile,"Biodiversity, Climate Change","Full-size Project","Food and Agriculture Organization","6,293,684","25,608,931",Completed,2015,"GEF Trust Fund",No,No,"GEF - 5"
"Scaling up Risk Transfer Mechanisms for Climate Vulnerable Agriculture-based Communities in Mindanao",4967,Philippines,"Climate Change","Full-size Project","United Nations Development Programme","1,050,000","16,250,000",Completed,2014,"Special Climate Change Fund",No,No,"GEF - 5"
"Sustainable Groundwater Management in SADC Member States",4966,"Tanzania, South Africa, Lesotho, Namibia, Zambia, Angola, Eswatini, Botswana, Zimbabwe, Seychelles, Malawi, Congo DR, Regional","International Waters","Full-size Project","The World Bank","8,200,000","42,608,000",Completed,2014,"GEF Trust Fund",No,No,"GEF - 5"
"National Biodiversity Planning to Support the implementation of the CBD 2011-2020 Strategic Plan in Egypt",4965,"Regional, Egypt",Biodiversity,"Enabling Activity","United Nations Development Programme","220,000","310,000",Completed,2012,"GEF Trust Fund",No,No,"GEF - 5"
"Pilot project on the development of a mercury inventory in China",4962,China,"Chemicals and Waste","Medium-size Project","United Nations Environment Programme","1,000,000","3,146,265",Completed,2012,"GEF Trust Fund",No,No,"GEF - 5"
"Enabling Activities to Review and Update the National Implementation Plan for the Stockholm Convention on Persistent Organic Pollutants (POPs)",4961,Armenia,"Chemicals and Waste","Enabling Activity","United Nations Industrial Development Organization","136,200","410,000",Completed,2012,"GEF Trust Fund",No,No,"GEF - 5"
"Scaling up Adaptation in Zimbabwe, with a Focus on Rural Livelihoods, by Strengthening Integrated Planning Systems",4960,Zimbabwe,"Climate Change","Full-size Project","United Nations Development Programme","3,980,000","12,700,000",Completed,2014,"Special Climate Change Fund",No,No,"GEF - 5"
"Climate Risk Finance for Sustainable and Climate Resilient Rainfed Farming and Pastoral Systems",4958,Sudan,"Climate Change","Full-size Project","United Nations Development Programme","5,700,000","18,800,000",Completed,2014,"Least Developed Countries Fund",No,No,"GEF - 5"
"Small and Medium Enterprise Energy Efficiency Project",4957,Türkiye,"Climate Change","Full-size Project","The World Bank","3,640,000","302,250,000",Completed,2013,"GEF Trust Fund",Yes,No,"GEF - 5"
"Community Agricultural Resource Management and Competitiveness  (CARMAC)",4954,Armenia,"Land Degradation","Medium-size Project","The World Bank","900,000","18,300,000",Completed,2012,"GEF Trust Fund",No,No,"GEF - 5"
"Landscape Approach to Forest Restoration and Conservation (LAFREC)",4952,Rwanda,"Biodiversity, Climate Change, Land Degradation","Full-size Project","The World Bank","9,532,000","51,596,000",Completed,2014,"Multi Trust Fund",No,No,"GEF - 5"
"Strengthening Liberia’s Capability to Provide  Climate Information and Services to Enhance Climate Resilient Development and Adaptation to Climate Change",4950,Liberia,"Climate Change","Full-size Project","United Nations Development Programme","6,730,000","11,859,700",Completed,2013,"Least Developed Countries Fund",No,No,"GEF - 5"
"Low-Carbon Urban Mobility for Large Cities",4949,Brazil,"Climate Change","Full-size Project","Inter-American Development Bank","6,000,000","144,581,638",Completed,2014,"GEF Trust Fund",No,No,"GEF - 5"
"Technology Needs Assessment",4948,Global,"Climate Change","Full-size Project","United Nations Environment Programme","6,105,835","2,156,921",Completed,2014,"GEF Trust Fund",No,No,"GEF - 5"
"Developing Market-based Energy Efficiency Program in China",4947,China,"Climate Change","Full-size Project","The World Bank","17,800,000","1,650,000,000",Completed,2017,"GEF Trust Fund",No,No,"GEF - 5"
"Collaborative Management for Watershed and Ecosystem Service Protection and Rehabilitation in the Cardamom Mountains, Upper Prek Thnot River Basin",4945,Cambodia,"Land Degradation","Full-size Project","United Nations Development Programme","1,100,917","4,940,000",Completed,2014,"GEF Trust Fund",No,No,"GEF - 5"
"India Ecosystems Service Improvement Project",4942,India,"Biodiversity, Climate Change","Full-size Project","The World Bank","20,500,000","115,000,000",Completed,2015,"GEF Trust Fund",No,No,"GEF - 5"
"Supporting Civil Society and Community Initiatives to Generate Global Environmental Benefits using Grants and Micro Loans in the Mediterranean Ecoregion of Chile",4939,Chile,"Biodiversity, Climate Change, Land Degradation","Full-size Project","United Nations Development Programme","3,311,614","17,119,772",Completed,2014,"GEF Trust Fund",No,No,"GEF - 5"
"Enhancing Capacity, Knowledge and Technology Support to Build Climate Resilience of Vulnerable Developing Countries",4934,"Nepal, Mauritania, Seychelles, Global","Climate Change","Full-size Project","United Nations Environment Programme","4,900,000","34,700,000",Completed,2013,"Special Climate Change Fund",No,No,"GEF - 5"
"Third National Communication to the United Nations Framework Convention on Climate Change",4933,Indonesia,"Climate Change","Full-size Project","United Nations Development Programme","4,500,000","21,022,040",Completed,2013,"GEF Trust Fund",No,No,"GEF - 5"
"Integrating Water, Land and Ecosystems Management in Caribbean Small Island Developing States (IWEco)",4932,"St. Kitts And Nevis, Jamaica, Trinidad and Tobago, Dominican Republic, St. Lucia, Antigua and Barbuda, Grenada, St. Vincent and Grenadines, Barbados, Cuba, Regional","Biodiversity, International Waters, Land Degradation","Full-size Project","United Nations Environment Programme, United Nations Development Programme","20,722,571","68,017,191",Completed,2015,"GEF Trust Fund",No,No,"GEF - 5"
"AfDB-PPP Public-Private Partnership Program",4929,"Africa, Regional","Climate Change",PFD,"African Development Bank","20,000,000","240,000,000",Completed,1970,"GEF Trust Fund",Yes,No,"GEF - 5"
"Decision Support for Mainstreaming and Scaling up of Sustainable Land Management",4922,"Morocco, Uzbekistan, Argentina, Thailand, Lesotho, Panama, Tunisia, China, Bangladesh, Türkiye, Ecuador, Nigeria, Bosnia-Herzegovina, Colombia, Philippines, Global","Land Degradation","Full-size Project","Food and Agriculture Organization","6,116,730","38,097,347",Completed,2014,"GEF Trust Fund",No,No,"GEF - 5"
"Efficient and Sustainable City Bus Services",4921,India,"Climate Change","Full-size Project","The World Bank","9,200,000","113,636,000",Completed,2014,"GEF Trust Fund",No,No,"GEF - 5"
"Enabling Activities to Review and Update the National Implementation Plan for the Stockholm Convention on Persistent Organic Pollutants (POPs)",4919,Türkiye,"Chemicals and Waste","Enabling Activity","United Nations Industrial Development Organization","225,000","386,000",Completed,2012,"GEF Trust Fund",No,No,"GEF - 5"
"Enabling Activities to Review and Update the National Implementation Plan for the Stockholm Convention on Persistent Organic Pollutants (POPs)",4917,Philippines,"Chemicals and Waste","Enabling Activity","United Nations Industrial Development Organization","225,000","225,000",Completed,2012,"GEF Trust Fund",No,No,"GEF - 5"
"Conservation of Biodiversity in Landscapes Impacted by Mining in the Choco Biogeographic Region",4916,Colombia,Biodiversity,"Full-size Project","United Nations Development Programme","5,850,000","30,642,752",Completed,2014,"GEF Trust Fund",No,No,"GEF - 5"
"Environmentally Sound Management and Final Disposal of PCBs at the Russian Railroad Network and Other PCB Owners",4915,"Russian Federation","Chemicals and Waste, Chemicals and Waste","Full-size Project","United Nations Industrial Development Organization","7,400,000","34,200,000",Completed,2013,"GEF Trust Fund",No,No,"GEF - 5"
"Capacity Development: Integrating Rio Convention Provisions into Ukraine's National Environmental Policy Framework",4913,Ukraine,,"Medium-size Project","United Nations Development Programme","900,000","1,030,000",Completed,2013,"GEF Trust Fund",No,No,"GEF - 5"
"GGW: Agriculture Production Support Project (with Sustainable Land and Water Management)",4908,Chad,"Biodiversity, Climate Change, Land Degradation","Full-size Project","The World Bank","9,259,259","102,250,000",Completed,2012,"Multi Trust Fund",No,No,"GEF - 5"
"GGW: Nigeria Erosion and Watershed Management Project (NEWMAP)",4907,Nigeria,"Biodiversity, Climate Change, Land Degradation","Full-size Project","The World Bank","8,592,593","500,000,000",Completed,2012,"Multi Trust Fund",No,No,"GEF - 5"
"India: Sustainable Livelihoods and Adaptation to Climate Change (SLACC)",4901,India,"Climate Change","Full-size Project","The World Bank","8,000,000","52,200,000",Completed,2014,"Special Climate Change Fund",No,No,"GEF - 5"
"Scale Up of Access to Clean Energy for Rural Productive and Domestic Uses",4900,India,"Climate Change","Full-size Project","United Nations Development Programme","4,006,849","19,033,767",Completed,2014,"GEF Trust Fund",No,No,"GEF - 5"
"CBPF-MSL: Strengthening the Management Effectiveness of the Wetland Protected Area System in Anhui Province",4896,China,Biodiversity,"Full-size Project","United Nations Development Programme","2,654,771","18,147,255",Completed,2013,"GEF Trust Fund",No,No,"GEF - 5"
"Transforming Effectiveness of Biodiversity Conservation in Priority Sumatran Landscapes",4892,Indonesia,Biodiversity,"Full-size Project","United Nations Development Programme","9,000,000","53,450,000",Completed,2015,"GEF Trust Fund",No,No,"GEF - 5"
"Towards a Green Economy in Uruguay: Stimulating Sustainable Production Practices and Low-emission Technologies in Prioritized Sectors",4890,Uruguay,"Climate Change","Full-size Project","United Nations Industrial Development Organization","3,392,727","32,410,000",Completed,2013,"GEF Trust Fund",Yes,No,"GEF - 5"
"Nationally Appropriate Mitigation Actions in the Energy Generation and End-Use Sectors",4884,Peru,"Climate Change","Full-size Project","United Nations Development Programme","4,500,000","32,010,000",Completed,2014,"GEF Trust Fund",No,No,"GEF - 5"
"Integrating the Management of Protection and Production Areas for Biodiversity Conservation in the Sierra Tarahumara of Chihuahua",4883,Mexico,Biodiversity,"Full-size Project","United Nations Environment Programme","4,900,000","40,036,159",Completed,2014,"GEF Trust Fund",No,No,"GEF - 5"
"Enabling China to Prepare Its Third National Communication (3NC) and Biennial Update Report  to the UNFCCC",4882,China,"Climate Change","Full-size Project","United Nations Development Programme","7,280,000","900,000",Completed,2014,"GEF Trust Fund",No,No,"GEF - 5"
"Climate Technology Transfer Mechanisms and Networks in Latin America and the Caribbean",4880,"Latin America and Caribbean, Regional","Climate Change","Full-size Project","Inter-American Development Bank","10,899,000","56,550,000",Completed,2014,"Multi Trust Fund",No,No,"GEF - 5"
"GHG Emissions Reductions in Targeted Industrial Sub-Sectors through EE and Application of Solar Thermal Systems",4878,Malaysia,"Climate Change","Full-size Project","United Nations Industrial Development Organization","4,000,000","20,000,000",Completed,2014,"GEF Trust Fund",No,No,"GEF - 5"
"Environmentally-Sound Management and Final Disposal of PCBs",4877,Serbia,"Chemicals and Waste, Chemicals and Waste","Full-size Project","United Nations Industrial Development Organization","2,100,000","9,129,630",Completed,2014,"GEF Trust Fund",No,No,"GEF - 5"
"National Biodiversity Planning to Support the Implementation of the CBD 2011-2020 Strategic Plan",4876,"Regional, Montenegro",Biodiversity,"Enabling Activity","United Nations Development Programme","210,000","240,000",Completed,2012,"GEF Trust Fund",No,No,"GEF - 5"
"Updating the National Biodiversity Strategy and Developing the Action Plan to Support the Implementation of the CBD 2011-2020 Strategic Plan",4871,"Regional, Uruguay",Biodiversity,"Enabling Activity","United Nations Development Programme","220,800","224,800",Completed,2012,"GEF Trust Fund",No,No,"GEF - 5"
"CBPF-MSL: Strengthening the Management Effectiveness of the Wetland Protected Area System in Hubei Province",4870,China,Biodiversity,"Full-size Project","United Nations Development Programme","2,654,771","18,158,634",Completed,2013,"GEF Trust Fund",No,No,"GEF - 5"
"Urban-Scale Building Energy Efficiency and Renewable Energy",4869,China,"Climate Change","Full-size Project","The World Bank","12,000,000","138,590,000",Completed,2013,"GEF Trust Fund",No,No,"GEF - 5"
"CBPF-MSL: Strengthening the Management Effectiveness of the Protected Area Network in the Daxing’anling Landscape",4868,China,Biodiversity,"Full-size Project","United Nations Development Programme","3,544,679","24,500,000",Completed,2013,"GEF Trust Fund",No,No,"GEF - 5"
"Enhancing the Protected Area System in Sulawesi  (E-PASS) for Biodiversity Conservation",4867,Indonesia,Biodiversity,"Full-size Project","United Nations Development Programme","6,265,000","43,700,000",Completed,2014,"GEF Trust Fund",No,No,"GEF - 5"
"National Biodiversity Planning to Support the Implementation of the CBD 2011-2020 Strategic Plan",4863,"Regional, Ecuador",Biodiversity,"Enabling Activity","United Nations Development Programme","251,442","443,558",Completed,2012,"GEF Trust Fund",No,No,"GEF - 5"
"Reduction of POPs and PTS Release by Environmentally Sound Management throughout the Life Cycle of  Electrical and Electronic Equipment and Associated Wastes in China",4862,China,"Chemicals and Waste, Chemicals and Waste","Full-size Project","United Nations Development Programme","11,650,000","47,000,000",Completed,2014,"GEF Trust Fund",No,No,"GEF - 5"
"Mainstreaming Biodiversity Conservation and Sustainable Land Management into Production Practices in all Bioregions and Biomes",4860,Paraguay,"Biodiversity, Land Degradation","Full-size Project","United Nations Development Programme","6,861,817","22,437,030",Completed,2013,"GEF Trust Fund",No,No,"GEF - 5"
"National Biodiversity Planning to Support the Implementation of the CBD 2011-2020 Strategic Plan",4857,"Regional, Chile",Biodiversity,"Enabling Activity","United Nations Development Programme","271,600","339,160",Completed,2012,"GEF Trust Fund",No,No,"GEF - 5"
"Oceans Finance Facility to Finance Effective Management and Transitional Reform of OceanicFisheries. N.B. Retitled at PPG stage to: Ocean Partnerships for Sustainable Fisheries and Biodiversity Conservation - Models for Innovation and Reform  (P128437)",4856,Global,"Biodiversity, International Waters","Full-size Project","The World Bank","9,174,311","40,000,000",Completed,2014,"GEF Trust Fund",No,No,"GEF - 5"
"Kihansi Catchment Conservation and Management",4855,Tanzania,Biodiversity,"Full-size Project","The World Bank","5,980,544","18,300,000",Completed,2013,"GEF Trust Fund",No,No,"GEF - 5"
"POPs and Chemical Pollution Solutions through Area-based-Ecoeffective-Management",4854,China,"Chemicals and Waste, Chemicals and Waste","Full-size Project","United Nations Industrial Development Organization","6,000,000","24,000,000",Completed,2015,"GEF Trust Fund",No,No,"GEF - 5"
"National Biodiversity Planning to Support the Implementation of the CBD 2011-2020 Strategic Plan in Morocco",4853,"Regional, Morocco",Biodiversity,"Enabling Activity","United Nations Development Programme","220,000","150,000",Completed,2012,"GEF Trust Fund",No,No,"GEF - 5"
"Improving Management Effectiveness of the Protected Area Network",4848,"South Africa",Biodiversity,"Full-size Project","United Nations Development Programme","8,550,000","49,559,113",Completed,2014,"GEF Trust Fund",No,No,"GEF - 5"
"A Landscape Approach to the Conservation of Threatened Mountain Ecosystems",4846,Cuba,Biodiversity,"Full-size Project","United Nations Development Programme","7,481,944","58,336,630",Completed,2014,"GEF Trust Fund",No,No,"GEF - 5"
"Improving the Coverage and Management Effectiveness of PAs in the Central Tian Shan Mountains",4844,"Kyrgyz Republic",Biodiversity,"Medium-size Project","United Nations Development Programme","950,000","4,966,666",Completed,2013,"GEF Trust Fund",No,No,"GEF - 5"
"Strengthening the Institutional and Financial Sustainability of the National Protected Area System",4842,Croatia,Biodiversity,"Full-size Project","United Nations Development Programme","4,953,000","18,011,116",Completed,2013,"GEF Trust Fund",No,No,"GEF - 5"
"Strengthening the Effectiveness of the National Protected Area System by Including a Landscape Approach to Management",4841,Uruguay,Biodiversity,"Full-size Project","United Nations Development Programme","1,621,000","8,873,161",Completed,2013,"GEF Trust Fund",No,No,"GEF - 5"
"Energy Efficient Production and Utilization of Charcoal through Innovative Technologies and Private Sector Involvement",4840,"Sierra Leone","Climate Change","Full-size Project","United Nations Development Programme","1,768,182","9,000,000",Completed,2014,"GEF Trust Fund",No,No,"GEF - 5"
"Establishing Integrated Models for Protected Areas and their Co-management",4839,Afghanistan,"Biodiversity, Land Degradation","Full-size Project","United Nations Development Programme","6,441,819","53,300,000",Completed,2014,"GEF Trust Fund",No,No,"GEF - 5"
"Updating Vietnam National Implementation Plan for the Stockholm Convention on Persistent Organic Pollutants",4838,"Viet Nam","Chemicals and Waste","Enabling Activity","United Nations Development Programme","225,000","160,000",Completed,2012,"GEF Trust Fund",No,No,"GEF - 5"
"Conservation, Sustainable Use of Biodiversity, and Maintenance of Ecosystem Services of Internationally Important Protected Wetlands",4836,"Costa Rica",Biodiversity,"Full-size Project","United Nations Development Programme","3,705,873","17,188,318",Completed,2014,"GEF Trust Fund",No,No,"GEF - 5"
"Expansion and Improved Management Effectiveness of the Achara Region’s Protected Areas",4835,Georgia,Biodiversity,"Full-size Project","United Nations Development Programme","1,283,636","13,715,142",Completed,2013,"GEF Trust Fund",No,No,"GEF - 5"
"Recovery and Protection of Climate and Biodiversity Services in the Southeast Atlantic Forest Corridor of Brazil",4834,Brazil,"Biodiversity, Climate Change","Full-size Project","Inter-American Development Bank","31,505,960","187,819,043",Completed,2014,"GEF Trust Fund",No,No,"GEF - 5"
"National Biodiversity Planning to Support the Implementation of the CBD 2011-2020 Strategic Plan in Yemen",4833,"Regional, Yemen",Biodiversity,"Enabling Activity","United Nations Development Programme","220,000","78,000",Completed,2012,"GEF Trust Fund",No,No,"GEF - 5"
"Sustainable Management of Namibia’s Forested Lands",4832,Namibia,"Land Degradation","Full-size Project","United Nations Development Programme","4,446,000","20,000,000",Completed,2013,"GEF Trust Fund",No,No,"GEF - 5"
"Enhancing Wildlife Conservation in the Productive Southern Kenya Rangelands through a Landscape Approach",4827,Kenya,Biodiversity,"Full-size Project","United Nations Development Programme","3,990,909","24,820,000",Completed,2014,"GEF Trust Fund",No,No,"GEF - 5"
"Developing National Biodiversity Strategy and Action Plan and Mainstreaming Biodiversity Conservation into Provincial Planning",4826,"Viet Nam",Biodiversity,"Medium-size Project","United Nations Development Programme","909,091","4,550,000",Completed,2012,"GEF Trust Fund",No,No,"GEF - 5"
"Strengthening Resilience to Climate Change through Integrated Agricultural and Pastoral Management in the Sahelian zone in the Framework of the Sustainable Land Management Approach",4822,Mali,"Climate Change","Full-size Project","Food and Agriculture Organization","2,172,727","14,247,259",Completed,2014,"Least Developed Countries Fund",No,No,"GEF - 5"
"National Biodiversity Planning to Support the  Implementation of the CBD 2011-2020 Strategic Plan",4821,"Regional, Costa Rica",Biodiversity,"Enabling Activity","United Nations Development Programme","220,000","231,520",Completed,2012,"GEF Trust Fund",No,No,"GEF - 5"
"Reduction of Mercury Emissions and Promotion of Sound Chemical Management in Zinc Smelting Operations",4816,China,"Chemicals and Waste","Medium-size Project","United Nations Industrial Development Organization","990,000","4,000,000",Completed,2012,"GEF Trust Fund",No,No,"GEF - 5"
"National Biodiversity Planning to Support the Implementation of the CBD 2011-2020 Strategic Plan in Zimbabwe",4814,"Regional, Zimbabwe",Biodiversity,"Enabling Activity","United Nations Development Programme","220,000","334,000",Completed,2012,"GEF Trust Fund",No,No,"GEF - 5"
"National Biodiversity Planning to Support the implementation of the CBD 2011-2020 Strategic Plan in Malaysia.",4813,"Regional, Malaysia",Biodiversity,"Enabling Activity","United Nations Development Programme","220,000","1,100,000",Completed,2012,"GEF Trust Fund",No,No,"GEF - 5"
"CBPF-MSL: Strengthening the Management Effectiveness of the Wetland Protected Area System in Hainan for Conservation of Globally Significant Biodiversity",4811,China,Biodiversity,"Full-size Project","United Nations Development Programme","2,634,771","18,000,000",Completed,2013,"GEF Trust Fund",No,No,"GEF - 5"
"Strengthening the Marine Protected Area System to Conserve Marine Key Biodiversity Areas",4810,Philippines,Biodiversity,"Full-size Project","United Nations Development Programme","8,000,000","25,833,490",Completed,2014,"GEF Trust Fund",No,No,"GEF - 5"
"National Biodiversity Planning to Support the Implementation of the CBD 2011-2020 Strategic Plan",4809,"Regional, Guatemala",Biodiversity,"Enabling Activity","United Nations Development Programme","221,005","293,050",Completed,2013,"GEF Trust Fund",No,No,"GEF - 5"
"Updating the National Biodiversity Strategy and Developing the Action Plan to Support the Implementation of the CBD 2011-2020 Strategic Plan",4808,"Regional, Peru",Biodiversity,"Enabling Activity","United Nations Development Programme","320,000","344,000",Completed,2012,"GEF Trust Fund",No,No,"GEF - 5"
"A Global Initiative on Landscapes for People, Food and Nature",4806,Global,"Land Degradation","Medium-size Project","United Nations Environment Programme","1,000,000","2,621,868",Completed,2012,"GEF Trust Fund",No,No,"GEF - 5"
"Promotion of Non-fired Brick (NFB) Production and Utilization",4801,"Viet Nam","Climate Change","Full-size Project","United Nations Development Programme","2,800,000","36,080,000",Completed,2014,"GEF Trust Fund",Yes,No,"GEF - 5"
